PROVINCIA_OPERADORA,CIUDAD_OPERADORA,IDENTIFICACION_OPERADORA,TIPO_OPERADORA,LATITUD,LONGITUD,UBICACION_EXCESO,CIUDAD_EXCESO,PROVINCIA_EXCESO,FECHA_ALERTA,HORA_ALERTA,VELOCIDAD,TIPO_EXCESO,FECHA_ALERTA_DT,HORA_ALERTA_NUM,hora,dia_num,franja_horaria,dia_semana
AZUAY,CHORDELEG,CHORDELEG_1,INTER PROVINCIAL,-2.895025,-7898039333,"CUENCA,CUENCA,AZUAY",CHORDELEG,AZUAY,4/2/2022,12:20:34,103,CUARTA_CLASE,2022-02-04,12,12,5,Tarde,Viernes
AZUAY,CUENCA,CUENCA_6,INTER PROVINCIAL,-3.316711667,-7965767833,"PUCARA,PUCARA,AZUAY",CUENCA,AZUAY,2/2/2022,08:42:03,101,CUARTA_CLASE,2022-02-02,8,8,3,Ma√±ana,Mi√©rcoles
AZUAY,CUENCA,CUENCA_6,INTER PROVINCIAL,-3.315931667,-7959226333,"PUCARA,PUCARA,AZUAY",CUENCA,AZUAY,11/2/2022,07:10:58,101,CUARTA_CLASE,2022-02-11,7,7,5,Ma√±ana,Viernes
AZUAY,CUENCA,CUENCA_6,INTER PROVINCIAL,-3.328715,-7936929,"SANTA ISABEL,SANTA ISABEL,AZUAY",CUENCA,AZUAY,6/2/2022,12:59:27,103,CUARTA_CLASE,2022-02-06,12,12,7,Tarde,Domingo
AZUAY,CUENCA,CUENCA_6,INTER PROVINCIAL,-3.185555,-7917051167,"GIRON,GIRON,AZUAY",CUENCA,AZUAY,2/2/2022,07:30:55,101,CUARTA_CLASE,2022-02-02,7,7,3,Ma√±ana,Mi√©rcoles
AZUAY,CUENCA,CUENCA_1,INTER PROVINCIAL,-2.8494483330000002,-7889823333,"NULTI,CUENCA,AZUAY",CUENCA,AZUAY,10/2/2022,13:51:10,101,CUARTA_CLASE,2022-02-10,13,13,4,Tarde,Jueves
AZUAY,CUENCA,CUENCA_1,INTER PROVINCIAL,-2.853193333,-7890975333,"NULTI,CUENCA,AZUAY",CUENCA,AZUAY,10/2/2022,13:50:22,105,CUARTA_CLASE,2022-02-10,13,13,4,Tarde,Jueves
AZUAY,CUENCA,CUENCA_1,INTER PROVINCIAL,-2.886466667,-7894944833,"CUENCA,CUENCA,AZUAY",CUENCA,AZUAY,10/2/2022,13:46:08,105,CUARTA_CLASE,2022-02-10,13,13,4,Tarde,Jueves
AZUAY,CUENCA,CUENCA_1,INTER PROVINCIAL,-2.868273333,-7893606667,"CUENCA,CUENCA,AZUAY",CUENCA,AZUAY,10/2/2022,17:55:17,107,CUARTA_CLASE,2022-02-10,17,17,4,Tarde,Jueves
AZUAY,CUENCA,CUENCA_1,INTER PROVINCIAL,-2.820528333,-78772515,"PAUTE,PAUTE,AZUAY",CUENCA,AZUAY,2/2/2022,06:47:07,101,CUARTA_CLASE,2022-02-02,6,6,3,Ma√±ana,Mi√©rcoles
AZUAY,CUENCA,CUENCA_1,INTER PROVINCIAL,-2.847668333,-7889272167,"NULTI,CUENCA,AZUAY",CUENCA,AZUAY,10/2/2022,13:51:34,103,CUARTA_CLASE,2022-02-10,13,13,4,Tarde,Jueves
AZUAY,CUENCA,CUENCA_7,INTER PROVINCIAL,-3.289603333,-7910288667,"NABON,NABON,AZUAY",CUENCA,AZUAY,3/2/2022,10:34:27,103,CUARTA_CLASE,2022-02-03,10,10,4,Ma√±ana,Jueves
AZUAY,CUENCA,CUENCA_7,INTER PROVINCIAL,-3.285538333,-7909774833,"NABON,NABON,AZUAY",CUENCA,AZUAY,3/2/2022,10:34:53,103,CUARTA_CLASE,2022-02-03,10,10,4,Ma√±ana,Jueves
AZUAY,CUENCA,CUENCA_7,INTER PROVINCIAL,-3.229913333,-7904450167,"NABON,NABON,AZUAY",CUENCA,AZUAY,3/2/2022,10:41:39,101,CUARTA_CLASE,2022-02-03,10,10,4,Ma√±ana,Jueves
AZUAY,CUENCA,CUENCA_7,INTER PROVINCIAL,-3.092778333,-79010415,"CUMBE,CUENCA,AZUAY",CUENCA,AZUAY,3/2/2022,10:58:02,105,CUARTA_CLASE,2022-02-03,10,10,4,Ma√±ana,Jueves
AZUAY,CUENCA,CUENCA_7,INTER PROVINCIAL,-2.449243333,-7906717,"SUSCAL,SUSCAL,CA—AR",CUENCA,AZUAY,3/2/2022,11:00:24,103,CUARTA_CLASE,2022-02-03,11,11,4,Ma√±ana,Jueves
AZUAY,CUENCA,CUENCA_7,INTER PROVINCIAL,-2.440025,-7905566333,"SUSCAL,SUSCAL,CA—AR",CUENCA,AZUAY,3/2/2022,11:01:40,103,CUARTA_CLASE,2022-02-03,11,11,4,Ma√±ana,Jueves
AZUAY,CUENCA,CUENCA_7,INTER PROVINCIAL,-3.05279,-7903813333,"CUMBE,CUENCA,AZUAY",CUENCA,AZUAY,3/2/2022,11:02:03,101,CUARTA_CLASE,2022-02-03,11,11,4,Ma√±ana,Jueves
AZUAY,CUENCA,CUENCA_7,INTER PROVINCIAL,-2.79089,-7887017167,"JAVIER LOYOLA,AZOGUES,CA—AR",CUENCA,AZUAY,3/2/2022,12:53:38,101,CUARTA_CLASE,2022-02-03,12,12,4,Tarde,Jueves
AZUAY,CUENCA,CUENCA_7,INTER PROVINCIAL,-2.798155,-7887941667,"JAVIER LOYOLA,AZOGUES,CA—AR",CUENCA,AZUAY,3/2/2022,12:54:27,105,CUARTA_CLASE,2022-02-03,12,12,4,Tarde,Jueves
AZUAY,CUENCA,CUENCA_7,INTER PROVINCIAL,-2.316308333,-79469375,"EL TRIUNFO,EL TRIUNFO,GUAYAS",CUENCA,AZUAY,2/2/2022,20:09:02,101,CUARTA_CLASE,2022-02-02,20,20,3,Noche,Mi√©rcoles
AZUAY,CUENCA,CUENCA_7,INTER PROVINCIAL,-2.311503333,-7947551333,"EL TRIUNFO,EL TRIUNFO,GUAYAS",CUENCA,AZUAY,2/2/2022,20:09:33,101,CUARTA_CLASE,2022-02-02,20,20,3,Noche,Mi√©rcoles
AZUAY,CUENCA,CUENCA_7,INTER PROVINCIAL,-2.255073333,-7961185333,"GRAL. PEDRO J. MONTERO,SAN JACINTO DE YAGUACHI,GUAYAS",CUENCA,AZUAY,2/2/2022,20:20:36,101,CUARTA_CLASE,2022-02-02,20,20,3,Noche,Mi√©rcoles
AZUAY,CUENCA,CUENCA_7,INTER PROVINCIAL,-2.220496667,-7968777333,"VIRGEN DE FATIMA,SAN JACINTO DE YAGUACHI,GUAYAS",CUENCA,AZUAY,2/2/2022,20:30:31,101,CUARTA_CLASE,2022-02-02,20,20,3,Noche,Mi√©rcoles
AZUAY,CUENCA,CUENCA_7,INTER PROVINCIAL,-3.543916667,-79179055,"EL TABLON,SARAGURO,LOJA",CUENCA,AZUAY,4/2/2022,12:44:07,107,CUARTA_CLASE,2022-02-04,12,12,5,Tarde,Viernes
AZUAY,CUENCA,CUENCA_7,INTER PROVINCIAL,-2.284943333,-7951372833,"EL TRIUNFO,EL TRIUNFO,GUAYAS",CUENCA,AZUAY,4/2/2022,21:31:45,103,CUARTA_CLASE,2022-02-04,21,21,5,Noche,Viernes
AZUAY,CUENCA,CUENCA_7,INTER PROVINCIAL,-2.282401667,-7951750833,"EL TRIUNFO,EL TRIUNFO,GUAYAS",CUENCA,AZUAY,4/2/2022,21:32:03,101,CUARTA_CLASE,2022-02-04,21,21,5,Noche,Viernes
AZUAY,CUENCA,CUENCA_7,INTER PROVINCIAL,-2.279483333,-7952867,"EL TRIUNFO,EL TRIUNFO,GUAYAS",CUENCA,AZUAY,4/2/2022,21:32:52,101,CUARTA_CLASE,2022-02-04,21,21,5,Noche,Viernes
AZUAY,CUENCA,CUENCA_7,INTER PROVINCIAL,-2.257545,-7957266667,"GRAL. PEDRO J. MONTERO,SAN JACINTO DE YAGUACHI,GUAYAS",CUENCA,AZUAY,4/2/2022,21:36:27,101,CUARTA_CLASE,2022-02-04,21,21,5,Noche,Viernes
AZUAY,CUENCA,CUENCA_7,INTER PROVINCIAL,-2.255411667,-796067,"GRAL. PEDRO J. MONTERO,SAN JACINTO DE YAGUACHI,GUAYAS",CUENCA,AZUAY,4/2/2022,21:39:23,101,CUARTA_CLASE,2022-02-04,21,21,5,Noche,Viernes
AZUAY,CUENCA,CUENCA_7,INTER PROVINCIAL,-2.228891667,-7966654667,"VIRGEN DE FATIMA,SAN JACINTO DE YAGUACHI,GUAYAS",CUENCA,AZUAY,4/2/2022,21:47:03,105,CUARTA_CLASE,2022-02-04,21,21,5,Noche,Viernes
AZUAY,CUENCA,CUENCA_7,INTER PROVINCIAL,-2.21502,-797054,"ELOY ALFARO,DURAN,GUAYAS",CUENCA,AZUAY,4/2/2022,21:50:01,103,CUARTA_CLASE,2022-02-04,21,21,5,Noche,Viernes
AZUAY,CUENCA,CUENCA_7,INTER PROVINCIAL,-2.197496667,-7978294833,"ELOY ALFARO,DURAN,GUAYAS",CUENCA,AZUAY,4/2/2022,21:57:17,103,CUARTA_CLASE,2022-02-04,21,21,5,Noche,Viernes
AZUAY,CUENCA,CUENCA_7,INTER PROVINCIAL,-2.193398333,-7979114167,"ELOY ALFARO,DURAN,GUAYAS",CUENCA,AZUAY,4/2/2022,21:57:53,101,CUARTA_CLASE,2022-02-04,21,21,5,Noche,Viernes
AZUAY,CUENCA,CUENCA_7,INTER PROVINCIAL,-2.575006667,-7952784667,"JESUS MARIA,NARANJAL,GUAYAS",CUENCA,AZUAY,1/2/2022,13:54:41,103,CUARTA_CLASE,2022-02-01,13,13,2,Tarde,Martes
AZUAY,CUENCA,CUENCA_7,INTER PROVINCIAL,-2.578178333,-7951844667,"JESUS MARIA,NARANJAL,GUAYAS",CUENCA,AZUAY,1/2/2022,13:55:22,105,CUARTA_CLASE,2022-02-01,13,13,2,Tarde,Martes
AZUAY,CUENCA,CUENCA_7,INTER PROVINCIAL,-2.212478333,-7971231333,"ELOY ALFARO,DURAN,GUAYAS",CUENCA,AZUAY,3/2/2022,08:39:14,101,CUARTA_CLASE,2022-02-03,8,8,4,Ma√±ana,Jueves
AZUAY,CUENCA,CUENCA_7,INTER PROVINCIAL,-2.255315,-79609235,"GRAL. PEDRO J. MONTERO,SAN JACINTO DE YAGUACHI,GUAYAS",CUENCA,AZUAY,3/2/2022,08:49:43,103,CUARTA_CLASE,2022-02-03,8,8,4,Ma√±ana,Jueves
AZUAY,CUENCA,CUENCA_7,INTER PROVINCIAL,-2.256638333,-7958856,"GRAL. PEDRO J. MONTERO,SAN JACINTO DE YAGUACHI,GUAYAS",CUENCA,AZUAY,3/2/2022,08:51:07,101,CUARTA_CLASE,2022-02-03,8,8,4,Ma√±ana,Jueves
AZUAY,CUENCA,CUENCA_7,INTER PROVINCIAL,-2.279688333,-7952585,"EL TRIUNFO,EL TRIUNFO,GUAYAS",CUENCA,AZUAY,3/2/2022,08:55:59,101,CUARTA_CLASE,2022-02-03,8,8,4,Ma√±ana,Jueves
AZUAY,CUENCA,CUENCA_7,INTER PROVINCIAL,-2.285423333,-7951312167,"EL TRIUNFO,EL TRIUNFO,GUAYAS",CUENCA,AZUAY,3/2/2022,08:56:54,101,CUARTA_CLASE,2022-02-03,8,8,4,Ma√±ana,Jueves
AZUAY,CUENCA,CUENCA_7,INTER PROVINCIAL,-2.298635,-7949331,"EL TRIUNFO,EL TRIUNFO,GUAYAS",CUENCA,AZUAY,3/2/2022,08:58:31,101,CUARTA_CLASE,2022-02-03,8,8,4,Ma√±ana,Jueves
AZUAY,CUENCA,CUENCA_7,INTER PROVINCIAL,-2.303985,-7948527,"EL TRIUNFO,EL TRIUNFO,GUAYAS",CUENCA,AZUAY,3/2/2022,08:59:09,103,CUARTA_CLASE,2022-02-03,8,8,4,Ma√±ana,Jueves
AZUAY,CUENCA,CUENCA_7,INTER PROVINCIAL,-2.328583333,-79443075,"EL TRIUNFO,EL TRIUNFO,GUAYAS",CUENCA,AZUAY,3/2/2022,09:02:28,101,CUARTA_CLASE,2022-02-03,9,9,4,Ma√±ana,Jueves
AZUAY,CUENCA,CUENCA_7,INTER PROVINCIAL,-2.198598333,-79778835,"ELOY ALFARO,DURAN,GUAYAS",CUENCA,AZUAY,1/2/2022,04:34:49,101,CUARTA_CLASE,2022-02-01,4,4,2,Madrugada,Martes
AZUAY,CUENCA,CUENCA_7,INTER PROVINCIAL,-2.220098333,-7969027,"VIRGEN DE FATIMA,SAN JACINTO DE YAGUACHI,GUAYAS",CUENCA,AZUAY,1/2/2022,04:42:47,101,CUARTA_CLASE,2022-02-01,4,4,2,Madrugada,Martes
AZUAY,CUENCA,CUENCA_7,INTER PROVINCIAL,-2.22452,-79675665,"VIRGEN DE FATIMA,SAN JACINTO DE YAGUACHI,GUAYAS",CUENCA,AZUAY,1/2/2022,04:43:49,101,CUARTA_CLASE,2022-02-01,4,4,2,Madrugada,Martes
AZUAY,CUENCA,CUENCA_7,INTER PROVINCIAL,-2.231401667,-7966159667,"VIRGEN DE FATIMA,SAN JACINTO DE YAGUACHI,GUAYAS",CUENCA,AZUAY,1/2/2022,04:44:51,101,CUARTA_CLASE,2022-02-01,4,4,2,Madrugada,Martes
AZUAY,CUENCA,CUENCA_7,INTER PROVINCIAL,-2.234336667,-79653655,"VIRGEN DE FATIMA,SAN JACINTO DE YAGUACHI,GUAYAS",CUENCA,AZUAY,1/2/2022,04:45:25,101,CUARTA_CLASE,2022-02-01,4,4,2,Madrugada,Martes
AZUAY,CUENCA,CUENCA_7,INTER PROVINCIAL,-2.299503333,-7963870333,"TAURA,NARANJAL,GUAYAS",CUENCA,AZUAY,1/2/2022,04:52:18,103,CUARTA_CLASE,2022-02-01,4,4,2,Madrugada,Martes
AZUAY,CUENCA,CUENCA_7,INTER PROVINCIAL,-2.31635,-7963716167,"TAURA,NARANJAL,GUAYAS",CUENCA,AZUAY,1/2/2022,04:53:24,103,CUARTA_CLASE,2022-02-01,4,4,2,Madrugada,Martes
AZUAY,CUENCA,CUENCA_7,INTER PROVINCIAL,-2.220291667,-79689325,"VIRGEN DE FATIMA,SAN JACINTO DE YAGUACHI,GUAYAS",CUENCA,AZUAY,1/2/2022,13:00:41,101,CUARTA_CLASE,2022-02-01,13,13,2,Tarde,Martes
AZUAY,CUENCA,CUENCA_7,INTER PROVINCIAL,-2.22937,-7966586667,"VIRGEN DE FATIMA,SAN JACINTO DE YAGUACHI,GUAYAS",CUENCA,AZUAY,1/2/2022,13:02:25,105,CUARTA_CLASE,2022-02-01,13,13,2,Tarde,Martes
AZUAY,CUENCA,CUENCA_7,INTER PROVINCIAL,-2.309995,-7963776667,"TAURA,NARANJAL,GUAYAS",CUENCA,AZUAY,1/2/2022,13:13:30,101,CUARTA_CLASE,2022-02-01,13,13,2,Tarde,Martes
AZUAY,CUENCA,CUENCA_7,INTER PROVINCIAL,-2.319241667,-7963692833,"TAURA,NARANJAL,GUAYAS",CUENCA,AZUAY,1/2/2022,13:14:07,105,CUARTA_CLASE,2022-02-01,13,13,2,Tarde,Martes
AZUAY,CUENCA,#N/A,INTER PROVINCIAL,-2.447095,-7962755,"TAURA,NARANJAL,GUAYAS",CUENCA,AZUAY,1/2/2022,13:27:42,101,CUARTA_CLASE,2022-02-01,13,13,2,Tarde,Martes
AZUAY,CUENCA,#N/A,INTER PROVINCIAL,-2.290943333,-7963950167,"VIRGEN DE FATIMA,SAN JACINTO DE YAGUACHI,GUAYAS",CUENCA,AZUAY,2/2/2022,16:10:00,101,CUARTA_CLASE,2022-02-02,16,16,3,Tarde,Mi√©rcoles
AZUAY,CUENCA,#N/A,INTER PROVINCIAL,-2.58299,-7950381333,"JESUS MARIA,NARANJAL,GUAYAS",CUENCA,AZUAY,9/2/2022,16:18:47,101,CUARTA_CLASE,2022-02-09,16,16,3,Tarde,Mi√©rcoles
AZUAY,CUENCA,#N/A,INTER PROVINCIAL,-2.449846667,-7962784667,"TAURA,NARANJAL,GUAYAS",CUENCA,AZUAY,9/2/2022,16:36:39,103,CUARTA_CLASE,2022-02-09,16,16,3,Tarde,Mi√©rcoles
AZUAY,CUENCA,#N/A,INTER PROVINCIAL,-2.302773333,-7963836667,"TAURA,NARANJAL,GUAYAS",CUENCA,AZUAY,9/2/2022,16:50:24,105,CUARTA_CLASE,2022-02-09,16,16,3,Tarde,Mi√©rcoles
AZUAY,CUENCA,#N/A,INTER PROVINCIAL,-2.233085,-7965728667,"VIRGEN DE FATIMA,SAN JACINTO DE YAGUACHI,GUAYAS",CUENCA,AZUAY,9/2/2022,16:59:09,101,CUARTA_CLASE,2022-02-09,16,16,3,Tarde,Mi√©rcoles
AZUAY,CUENCA,#N/A,INTER PROVINCIAL,-2.596265,-7948084333,"JESUS MARIA,NARANJAL,GUAYAS",CUENCA,AZUAY,10/2/2022,07:23:04,105,CUARTA_CLASE,2022-02-10,7,7,4,Ma√±ana,Jueves
AZUAY,CUENCA,#N/A,INTER PROVINCIAL,-2.220393333,-7968868,"VIRGEN DE FATIMA,SAN JACINTO DE YAGUACHI,GUAYAS",CUENCA,AZUAY,10/2/2022,11:02:30,103,CUARTA_CLASE,2022-02-10,11,11,4,Ma√±ana,Jueves
AZUAY,CUENCA,#N/A,INTER PROVINCIAL,-2.229051667,-7966647833,"VIRGEN DE FATIMA,SAN JACINTO DE YAGUACHI,GUAYAS",CUENCA,AZUAY,10/2/2022,11:04:10,103,CUARTA_CLASE,2022-02-10,11,11,4,Ma√±ana,Jueves
AZUAY,CUENCA,#N/A,INTER PROVINCIAL,-2.28219,-7963929167,"VIRGEN DE FATIMA,SAN JACINTO DE YAGUACHI,GUAYAS",CUENCA,AZUAY,10/2/2022,11:11:22,101,CUARTA_CLASE,2022-02-10,11,11,4,Ma√±ana,Jueves
AZUAY,CUENCA,#N/A,INTER PROVINCIAL,-2.305793333,-7963814667,"TAURA,NARANJAL,GUAYAS",CUENCA,AZUAY,10/2/2022,11:13:00,103,CUARTA_CLASE,2022-02-10,11,11,4,Ma√±ana,Jueves
AZUAY,CUENCA,#N/A,INTER PROVINCIAL,-2.36661,-7963263333,"TAURA,NARANJAL,GUAYAS",CUENCA,AZUAY,10/2/2022,11:17:54,101,CUARTA_CLASE,2022-02-10,11,11,4,Ma√±ana,Jueves
AZUAY,CUENCA,#N/A,INTER PROVINCIAL,-2.503331667,-795916,"TAURA,NARANJAL,GUAYAS",CUENCA,AZUAY,10/2/2022,11:31:35,101,CUARTA_CLASE,2022-02-10,11,11,4,Ma√±ana,Jueves
AZUAY,CUENCA,#N/A,INTER PROVINCIAL,-2.513425,-79579495,"TAURA,NARANJAL,GUAYAS",CUENCA,AZUAY,10/2/2022,11:32:38,101,CUARTA_CLASE,2022-02-10,11,11,4,Ma√±ana,Jueves
AZUAY,CUENCA,#N/A,INTER PROVINCIAL,-2.319698333,-7946464167,"EL TRIUNFO,EL TRIUNFO,GUAYAS",CUENCA,AZUAY,7/2/2022,18:23:55,101,CUARTA_CLASE,2022-02-07,18,18,1,Noche,Lunes
AZUAY,CUENCA,#N/A,INTER PROVINCIAL,-2.31164,-79475305,"EL TRIUNFO,EL TRIUNFO,GUAYAS",CUENCA,AZUAY,7/2/2022,18:24:47,101,CUARTA_CLASE,2022-02-07,18,18,1,Noche,Lunes
AZUAY,CUENCA,#N/A,INTER PROVINCIAL,-2.300298333,-7949067167,"EL TRIUNFO,EL TRIUNFO,GUAYAS",CUENCA,AZUAY,7/2/2022,18:26:02,103,CUARTA_CLASE,2022-02-07,18,18,1,Noche,Lunes
AZUAY,CUENCA,#N/A,INTER PROVINCIAL,-2.291276667,-7950423333,"EL TRIUNFO,EL TRIUNFO,GUAYAS",CUENCA,AZUAY,7/2/2022,18:27:06,101,CUARTA_CLASE,2022-02-07,18,18,1,Noche,Lunes
AZUAY,CUENCA,#N/A,INTER PROVINCIAL,-2.286941667,-7951073833,"EL TRIUNFO,EL TRIUNFO,GUAYAS",CUENCA,AZUAY,7/2/2022,18:27:36,101,CUARTA_CLASE,2022-02-07,18,18,1,Noche,Lunes
AZUAY,CUENCA,#N/A,INTER PROVINCIAL,-2.274625,-79535855,"EL TRIUNFO,EL TRIUNFO,GUAYAS",CUENCA,AZUAY,7/2/2022,18:30:09,101,CUARTA_CLASE,2022-02-07,18,18,1,Noche,Lunes
AZUAY,CUENCA,#N/A,INTER PROVINCIAL,-2.267533333,-7954319333,"EL TRIUNFO,EL TRIUNFO,GUAYAS",CUENCA,AZUAY,7/2/2022,18:30:51,103,CUARTA_CLASE,2022-02-07,18,18,1,Noche,Lunes
AZUAY,CUENCA,#N/A,INTER PROVINCIAL,-2.260585,-7955025167,"EL TRIUNFO,EL TRIUNFO,GUAYAS",CUENCA,AZUAY,7/2/2022,18:31:30,101,CUARTA_CLASE,2022-02-07,18,18,1,Noche,Lunes
AZUAY,CUENCA,#N/A,INTER PROVINCIAL,-2.255156667,-79610355,"GRAL. PEDRO J. MONTERO,SAN JACINTO DE YAGUACHI,GUAYAS",CUENCA,AZUAY,7/2/2022,18:37:56,101,CUARTA_CLASE,2022-02-07,18,18,1,Noche,Lunes
AZUAY,CUENCA,#N/A,INTER PROVINCIAL,-2.227251667,-7966979667,"VIRGEN DE FATIMA,SAN JACINTO DE YAGUACHI,GUAYAS",CUENCA,AZUAY,7/2/2022,18:45:48,101,CUARTA_CLASE,2022-02-07,18,18,1,Noche,Lunes
AZUAY,CUENCA,#N/A,INTER PROVINCIAL,-2.212138333,-7971289833,"ELOY ALFARO,DURAN,GUAYAS",CUENCA,AZUAY,7/2/2022,18:49:06,101,CUARTA_CLASE,2022-02-07,18,18,1,Noche,Lunes
AZUAY,CUENCA,#N/A,INTER PROVINCIAL,-2.459113333,-7962663833,"TAURA,NARANJAL,GUAYAS",CUENCA,AZUAY,9/2/2022,10:36:01,101,CUARTA_CLASE,2022-02-09,10,10,3,Ma√±ana,Mi√©rcoles
AZUAY,CUENCA,#N/A,INTER PROVINCIAL,-2.518751667,-7957308667,"TAURA,NARANJAL,GUAYAS",CUENCA,AZUAY,9/2/2022,10:48:22,101,CUARTA_CLASE,2022-02-09,10,10,3,Ma√±ana,Mi√©rcoles
AZUAY,CUENCA,#N/A,INTER PROVINCIAL,-2.522113333,-79568705,"TAURA,NARANJAL,GUAYAS",CUENCA,AZUAY,9/2/2022,10:48:44,101,CUARTA_CLASE,2022-02-09,10,10,3,Ma√±ana,Mi√©rcoles
AZUAY,CUENCA,#N/A,INTER PROVINCIAL,-2.221243333,-7968425333,"VIRGEN DE FATIMA,SAN JACINTO DE YAGUACHI,GUAYAS",CUENCA,AZUAY,9/2/2022,06:28:00,101,CUARTA_CLASE,2022-02-09,6,6,3,Ma√±ana,Mi√©rcoles
AZUAY,CUENCA,#N/A,INTER PROVINCIAL,-2.21414,-797078,"ELOY ALFARO,DURAN,GUAYAS",CUENCA,AZUAY,9/2/2022,06:29:42,105,CUARTA_CLASE,2022-02-09,6,6,3,Ma√±ana,Mi√©rcoles
AZUAY,CUENCA,#N/A,INTER PROVINCIAL,-2.330555,-7942386,"EL TRIUNFO,EL TRIUNFO,GUAYAS",CUENCA,AZUAY,7/2/2022,06:28:01,103,CUARTA_CLASE,2022-02-07,6,6,1,Ma√±ana,Lunes
AZUAY,CUENCA,#N/A,INTER PROVINCIAL,-2.25569,-7960427667,"GRAL. PEDRO J. MONTERO,SAN JACINTO DE YAGUACHI,GUAYAS",CUENCA,AZUAY,6/2/2022,18:31:27,103,CUARTA_CLASE,2022-02-06,18,18,7,Noche,Domingo
AZUAY,CUENCA,#N/A,INTER PROVINCIAL,-2.284021667,-7951516833,"EL TRIUNFO,EL TRIUNFO,GUAYAS",CUENCA,AZUAY,6/2/2022,18:38:07,103,CUARTA_CLASE,2022-02-06,18,18,7,Noche,Domingo
AZUAY,CUENCA,#N/A,INTER PROVINCIAL,-2.325951667,-7944713167,"EL TRIUNFO,EL TRIUNFO,GUAYAS",CUENCA,AZUAY,6/2/2022,18:43:15,103,CUARTA_CLASE,2022-02-06,18,18,7,Noche,Domingo
AZUAY,CUENCA,#N/A,INTER PROVINCIAL,-2.294125,-7950006,"EL TRIUNFO,EL TRIUNFO,GUAYAS",CUENCA,AZUAY,6/2/2022,22:13:10,101,CUARTA_CLASE,2022-02-06,22,22,7,Noche,Domingo
AZUAY,CUENCA,#N/A,INTER PROVINCIAL,-2.866676667,-7893462333,"CUENCA,CUENCA,AZUAY",CUENCA,AZUAY,7/2/2022,14:03:07,101,CUARTA_CLASE,2022-02-07,14,14,1,Tarde,Lunes
AZUAY,CUENCA,#N/A,INTER PROVINCIAL,-2.264145,-7954667167,"EL TRIUNFO,EL TRIUNFO,GUAYAS",CUENCA,AZUAY,8/2/2022,06:50:25,101,CUARTA_CLASE,2022-02-08,6,6,2,Ma√±ana,Martes
AZUAY,CUENCA,#N/A,INTER PROVINCIAL,-2.283343333,-7951616333,"EL TRIUNFO,EL TRIUNFO,GUAYAS",CUENCA,AZUAY,8/2/2022,06:53:03,101,CUARTA_CLASE,2022-02-08,6,6,2,Ma√±ana,Martes
AZUAY,CUENCA,#N/A,INTER PROVINCIAL,-2.331091667,-7943957,"EL TRIUNFO,EL TRIUNFO,GUAYAS",CUENCA,AZUAY,8/2/2022,06:59:49,103,CUARTA_CLASE,2022-02-08,6,6,2,Ma√±ana,Martes
AZUAY,CUENCA,#N/A,INTER PROVINCIAL,-2.184888333,-7981083,"ELOY ALFARO,DURAN,GUAYAS",CUENCA,AZUAY,4/2/2022,21:59:25,105,CUARTA_CLASE,2022-02-04,21,21,5,Noche,Viernes
AZUAY,CUENCA,#N/A,INTER PROVINCIAL,-2.195436667,-7978786667,"ELOY ALFARO,DURAN,GUAYAS",CUENCA,AZUAY,5/2/2022,04:49:46,103,CUARTA_CLASE,2022-02-05,4,4,6,Madrugada,S√°bado
AZUAY,CUENCA,#N/A,INTER PROVINCIAL,-2.209591667,-7972922,"ELOY ALFARO,DURAN,GUAYAS",CUENCA,AZUAY,5/2/2022,04:56:50,103,CUARTA_CLASE,2022-02-05,4,4,6,Madrugada,S√°bado
AZUAY,CUENCA,#N/A,INTER PROVINCIAL,-2.210475,-79719065,"ELOY ALFARO,DURAN,GUAYAS",CUENCA,AZUAY,5/2/2022,04:57:33,103,CUARTA_CLASE,2022-02-05,4,4,6,Madrugada,S√°bado
AZUAY,CUENCA,#N/A,INTER PROVINCIAL,-2.217661667,-7969866,"VIRGEN DE FATIMA,SAN JACINTO DE YAGUACHI,GUAYAS",CUENCA,AZUAY,5/2/2022,04:59:00,103,CUARTA_CLASE,2022-02-05,4,4,6,Madrugada,S√°bado
AZUAY,CUENCA,#N/A,INTER PROVINCIAL,-2.227273333,-7967007667,"VIRGEN DE FATIMA,SAN JACINTO DE YAGUACHI,GUAYAS",CUENCA,AZUAY,5/2/2022,05:01:01,103,CUARTA_CLASE,2022-02-05,5,5,6,Madrugada,S√°bado
AZUAY,CUENCA,#N/A,INTER PROVINCIAL,-2.234095,-7965460833,"VIRGEN DE FATIMA,SAN JACINTO DE YAGUACHI,GUAYAS",CUENCA,AZUAY,5/2/2022,05:02:09,105,CUARTA_CLASE,2022-02-05,5,5,6,Madrugada,S√°bado
AZUAY,CUENCA,#N/A,INTER PROVINCIAL,-2.254953333,-7961431167,"GRAL. PEDRO J. MONTERO,SAN JACINTO DE YAGUACHI,GUAYAS",CUENCA,AZUAY,5/2/2022,05:07:17,103,CUARTA_CLASE,2022-02-05,5,5,6,Madrugada,S√°bado
AZUAY,CUENCA,#N/A,INTER PROVINCIAL,-2.256168333,-7959609333,"GRAL. PEDRO J. MONTERO,SAN JACINTO DE YAGUACHI,GUAYAS",CUENCA,AZUAY,5/2/2022,05:08:29,105,CUARTA_CLASE,2022-02-05,5,5,6,Madrugada,S√°bado
AZUAY,CUENCA,#N/A,INTER PROVINCIAL,-2.257803333,-7956953833,"GRAL. PEDRO J. MONTERO,SAN JACINTO DE YAGUACHI,GUAYAS",CUENCA,AZUAY,5/2/2022,05:10:13,101,CUARTA_CLASE,2022-02-05,5,5,6,Madrugada,S√°bado
AZUAY,CUENCA,#N/A,INTER PROVINCIAL,-2.3007049999999998,-79490195,"EL TRIUNFO,EL TRIUNFO,GUAYAS",CUENCA,AZUAY,5/2/2022,05:16:32,101,CUARTA_CLASE,2022-02-05,5,5,6,Madrugada,S√°bado
AZUAY,CUENCA,#N/A,INTER PROVINCIAL,-2.306335,-7948218333,"EL TRIUNFO,EL TRIUNFO,GUAYAS",CUENCA,AZUAY,5/2/2022,05:17:11,103,CUARTA_CLASE,2022-02-05,5,5,6,Madrugada,S√°bado
AZUAY,CUENCA,#N/A,INTER PROVINCIAL,-2.827716667,-78882155,"JAVIER LOYOLA,AZOGUES,CA—AR",CUENCA,AZUAY,5/2/2022,09:49:15,101,CUARTA_CLASE,2022-02-05,9,9,6,Ma√±ana,S√°bado
AZUAY,CUENCA,#N/A,INTER PROVINCIAL,-2.286743333,-7951107167,"EL TRIUNFO,EL TRIUNFO,GUAYAS",CUENCA,AZUAY,6/2/2022,22:14:03,105,CUARTA_CLASE,2022-02-06,22,22,7,Noche,Domingo
AZUAY,CUENCA,#N/A,INTER PROVINCIAL,-2.218946667,-79694835,"VIRGEN DE FATIMA,SAN JACINTO DE YAGUACHI,GUAYAS",CUENCA,AZUAY,6/2/2022,22:31:01,105,CUARTA_CLASE,2022-02-06,22,22,7,Noche,Domingo
AZUAY,CUENCA,#N/A,INTER PROVINCIAL,-2.213876667,-7970837833,"ELOY ALFARO,DURAN,GUAYAS",CUENCA,AZUAY,6/2/2022,22:32:01,101,CUARTA_CLASE,2022-02-06,22,22,7,Noche,Domingo
AZUAY,CUENCA,#N/A,INTER PROVINCIAL,-2.209226667,-7973293833,"ELOY ALFARO,DURAN,GUAYAS",CUENCA,AZUAY,6/2/2022,22:33:50,103,CUARTA_CLASE,2022-02-06,22,22,7,Noche,Domingo
AZUAY,CUENCA,#N/A,INTER PROVINCIAL,-2.197291667,-7978358833,"ELOY ALFARO,DURAN,GUAYAS",CUENCA,AZUAY,6/2/2022,22:39:21,101,CUARTA_CLASE,2022-02-06,22,22,7,Noche,Domingo
AZUAY,CUENCA,#N/A,INTER PROVINCIAL,-2.192438333,-7979274833,"ELOY ALFARO,DURAN,GUAYAS",CUENCA,AZUAY,6/2/2022,22:40:03,103,CUARTA_CLASE,2022-02-06,22,22,7,Noche,Domingo
AZUAY,CUENCA,#N/A,INTER PROVINCIAL,-2.504123333,-7959052833,"TAURA,NARANJAL,GUAYAS",CUENCA,AZUAY,6/2/2022,14:46:23,101,CUARTA_CLASE,2022-02-06,14,14,7,Tarde,Domingo
AZUAY,CUENCA,#N/A,INTER PROVINCIAL,-2.449938333,-7962781,"TAURA,NARANJAL,GUAYAS",CUENCA,AZUAY,6/2/2022,14:51:34,103,CUARTA_CLASE,2022-02-06,14,14,7,Tarde,Domingo
AZUAY,CUENCA,#N/A,INTER PROVINCIAL,-2.317853333,-7963693,"TAURA,NARANJAL,GUAYAS",CUENCA,AZUAY,6/2/2022,15:02:09,101,CUARTA_CLASE,2022-02-06,15,15,7,Tarde,Domingo
AZUAY,CUENCA,#N/A,INTER PROVINCIAL,-2.234471667,-7965283833,"VIRGEN DE FATIMA,SAN JACINTO DE YAGUACHI,GUAYAS",CUENCA,AZUAY,6/2/2022,15:10:31,101,CUARTA_CLASE,2022-02-06,15,15,7,Tarde,Domingo
AZUAY,CUENCA,#N/A,INTER PROVINCIAL,-2.284495,-7951448667,"EL TRIUNFO,EL TRIUNFO,GUAYAS",CUENCA,AZUAY,7/2/2022,06:20:33,101,CUARTA_CLASE,2022-02-07,6,6,1,Ma√±ana,Lunes
AZUAY,CUENCA,#N/A,INTER PROVINCIAL,-2.326841667,-7944544667,"EL TRIUNFO,EL TRIUNFO,GUAYAS",CUENCA,AZUAY,7/2/2022,06:26:22,103,CUARTA_CLASE,2022-02-07,6,6,1,Ma√±ana,Lunes
AZUAY,CUENCA,#N/A,INTER PROVINCIAL,-3.427081667,-7915494167,"SAN FELIPE DE O—A,O—A,AZUAY",CUENCA,AZUAY,3/2/2022,10:00:19,105,CUARTA_CLASE,2022-02-03,10,10,4,Ma√±ana,Jueves
AZUAY,CUENCA,#N/A,INTER PROVINCIAL,-3.353398333,-7918693833,"LAS NIEVES,NABON,AZUAY",CUENCA,AZUAY,3/2/2022,10:22:40,101,CUARTA_CLASE,2022-02-03,10,10,4,Ma√±ana,Jueves
AZUAY,CUENCA,#N/A,INTER PROVINCIAL,-2.22019,-7969003833,"VIRGEN DE FATIMA,SAN JACINTO DE YAGUACHI,GUAYAS",CUENCA,AZUAY,10/2/2022,12:00:26,109,CUARTA_CLASE,2022-02-10,12,12,4,Tarde,Jueves
AZUAY,CUENCA,#N/A,INTER PROVINCIAL,-2.846656667,-7889013833,"NULTI,CUENCA,AZUAY",CUENCA,AZUAY,2/2/2022,13:25:12,103,CUARTA_CLASE,2022-02-02,13,13,3,Tarde,Mi√©rcoles
AZUAY,CUENCA,#N/A,INTER PROVINCIAL,-2.25469,-7961770167,"GRAL. PEDRO J. MONTERO,SAN JACINTO DE YAGUACHI,GUAYAS",CUENCA,AZUAY,10/2/2022,12:09:10,107,CUARTA_CLASE,2022-02-10,12,12,4,Tarde,Jueves
AZUAY,CUENCA,#N/A,INTER PROVINCIAL,-2.256108333,-7959724333,"GRAL. PEDRO J. MONTERO,SAN JACINTO DE YAGUACHI,GUAYAS",CUENCA,AZUAY,10/2/2022,12:10:26,107,CUARTA_CLASE,2022-02-10,12,12,4,Tarde,Jueves
AZUAY,CUENCA,#N/A,INTER PROVINCIAL,-2.258695,-7955375667,"EL TRIUNFO,EL TRIUNFO,GUAYAS",CUENCA,AZUAY,10/2/2022,12:13:14,103,CUARTA_CLASE,2022-02-10,12,12,4,Tarde,Jueves
AZUAY,CUENCA,#N/A,INTER PROVINCIAL,-2.2657,-7954505,"EL TRIUNFO,EL TRIUNFO,GUAYAS",CUENCA,AZUAY,10/2/2022,12:14:01,107,CUARTA_CLASE,2022-02-10,12,12,4,Tarde,Jueves
AZUAY,CUENCA,#N/A,INTER PROVINCIAL,-2.308848333,-79478875,"EL TRIUNFO,EL TRIUNFO,GUAYAS",CUENCA,AZUAY,10/2/2022,12:18:46,105,CUARTA_CLASE,2022-02-10,12,12,4,Tarde,Jueves
AZUAY,CUENCA,#N/A,INTER PROVINCIAL,-2.312316667,-79474505,"EL TRIUNFO,EL TRIUNFO,GUAYAS",CUENCA,AZUAY,10/2/2022,12:19:08,107,CUARTA_CLASE,2022-02-10,12,12,4,Tarde,Jueves
AZUAY,CUENCA,#N/A,INTER PROVINCIAL,-2.360678333,-7939725,"MANUEL J. CALLE,LA TRONCAL,CA—AR",CUENCA,AZUAY,10/2/2022,12:28:00,101,CUARTA_CLASE,2022-02-10,12,12,4,Tarde,Jueves
AZUAY,CUENCA,#N/A,INTER PROVINCIAL,-2.37855,-7938357167,"MANUEL J. CALLE,LA TRONCAL,CA—AR",CUENCA,AZUAY,10/2/2022,12:30:24,101,CUARTA_CLASE,2022-02-10,12,12,4,Tarde,Jueves
AZUAY,CUENCA,#N/A,INTER PROVINCIAL,-2.801245,-7888070333,"JAVIER LOYOLA,AZOGUES,CA—AR",CUENCA,AZUAY,10/2/2022,16:31:22,101,CUARTA_CLASE,2022-02-10,16,16,4,Tarde,Jueves
AZUAY,CUENCA,#N/A,INTER PROVINCIAL,-2.190561667,-7979601667,"ELOY ALFARO,DURAN,GUAYAS",CUENCA,AZUAY,10/2/2022,11:50:52,101,CUARTA_CLASE,2022-02-10,11,11,4,Ma√±ana,Jueves
AZUAY,CUENCA,#N/A,INTER PROVINCIAL,-2.195996667,-7978685167,"ELOY ALFARO,DURAN,GUAYAS",CUENCA,AZUAY,10/2/2022,11:51:37,101,CUARTA_CLASE,2022-02-10,11,11,4,Ma√±ana,Jueves
AZUAY,CUENCA,#N/A,INTER PROVINCIAL,-2.209716667,-7972821333,"ELOY ALFARO,DURAN,GUAYAS",CUENCA,AZUAY,10/2/2022,11:57:48,103,CUARTA_CLASE,2022-02-10,11,11,4,Ma√±ana,Jueves
AZUAY,CUENCA,#N/A,INTER PROVINCIAL,-2.213371667,-7970987,"ELOY ALFARO,DURAN,GUAYAS",CUENCA,AZUAY,10/2/2022,11:59:00,101,CUARTA_CLASE,2022-02-10,11,11,4,Ma√±ana,Jueves
AZUAY,CUENCA,#N/A,INTER PROVINCIAL,-2.216478333,-7970167833,"ELOY ALFARO,DURAN,GUAYAS",CUENCA,AZUAY,10/2/2022,11:59:36,103,CUARTA_CLASE,2022-02-10,11,11,4,Ma√±ana,Jueves
AZUAY,CUENCA,#N/A,INTER PROVINCIAL,-2.25684,-7958479333,"GRAL. PEDRO J. MONTERO,SAN JACINTO DE YAGUACHI,GUAYAS",CUENCA,AZUAY,7/2/2022,17:15:35,122,PRIMERA_CLASE,2022-02-07,17,17,1,Tarde,Lunes
AZUAY,CUENCA,#N/A,INTER PROVINCIAL,-2.20898,-7973607333,"ELOY ALFARO,DURAN,GUAYAS",CUENCA,AZUAY,7/2/2022,13:42:12,103,CUARTA_CLASE,2022-02-07,13,13,1,Tarde,Lunes
AZUAY,CUENCA,#N/A,INTER PROVINCIAL,-2.225205,-7967416333,"VIRGEN DE FATIMA,SAN JACINTO DE YAGUACHI,GUAYAS",CUENCA,AZUAY,10/2/2022,12:01:29,105,CUARTA_CLASE,2022-02-10,12,12,4,Tarde,Jueves
AZUAY,CUENCA,#N/A,INTER PROVINCIAL,-2.331608333,-7942767167,"EL TRIUNFO,EL TRIUNFO,GUAYAS",CUENCA,AZUAY,11/2/2022,17:28:01,101,CUARTA_CLASE,2022-02-11,17,17,5,Tarde,Viernes
AZUAY,CUENCA,#N/A,INTER PROVINCIAL,-2.454843333,-79014605,"ZHUD,CA—AR",CUENCA,AZUAY,8/2/2022,10:01:23,101,CUARTA_CLASE,2022-02-08,10,10,2,Ma√±ana,Martes
AZUAY,CUENCA,#N/A,INTER PROVINCIAL,-1.96042,-7871745333,"GUAMOTE,GUAMOTE,CHIMBORAZO",CUENCA,AZUAY,9/2/2022,02:10:20,107,CUARTA_CLASE,2022-02-09,2,2,3,Madrugada,Mi√©rcoles
AZUAY,CUENCA,#N/A,INTER PROVINCIAL,-2.31937,-79465415,"EL TRIUNFO,EL TRIUNFO,GUAYAS",CUENCA,AZUAY,4/2/2022,02:50:32,107,CUARTA_CLASE,2022-02-04,2,2,5,Madrugada,Viernes
AZUAY,CUENCA,#N/A,INTER PROVINCIAL,-2.304066667,-7948509667,"EL TRIUNFO,EL TRIUNFO,GUAYAS",CUENCA,AZUAY,4/2/2022,02:48:56,107,CUARTA_CLASE,2022-02-04,2,2,5,Madrugada,Viernes
AZUAY,CUENCA,#N/A,INTER PROVINCIAL,-1.676816667,-7875852167,"VILLA LA UNION,COLTA,CHIMBORAZO",CUENCA,AZUAY,8/2/2022,03:32:02,114,CUARTA_CLASE,2022-02-08,3,3,2,Madrugada,Martes
AZUAY,CUENCA,#N/A,INTER PROVINCIAL,-2.293538333,-79500955,"EL TRIUNFO,EL TRIUNFO,GUAYAS",CUENCA,AZUAY,4/2/2022,02:47:44,109,CUARTA_CLASE,2022-02-04,2,2,5,Madrugada,Viernes
AZUAY,CUENCA,#N/A,INTER PROVINCIAL,-2.602946667,-79613085,"SANTA ROSA DE FLANDES,NARANJAL,GUAYAS",CUENCA,AZUAY,3/2/2022,14:32:30,103,CUARTA_CLASE,2022-02-03,14,14,4,Tarde,Jueves
AZUAY,CUENCA,#N/A,INTER PROVINCIAL,-3.309123333,-79882875,"EL CAMBIO,MACHALA,EL ORO",CUENCA,AZUAY,2/2/2022,22:34:39,101,CUARTA_CLASE,2022-02-02,22,22,3,Noche,Mi√©rcoles
AZUAY,CUENCA,#N/A,INTER PROVINCIAL,-3.053625,-79048505,"VICTORIA DEL PORTETE,CUENCA,AZUAY",CUENCA,AZUAY,4/2/2022,13:54:02,101,CUARTA_CLASE,2022-02-04,13,13,5,Tarde,Viernes
AZUAY,CUENCA,#N/A,INTER PROVINCIAL,-3.32568,-7936178,"SANTA ISABEL,SANTA ISABEL,AZUAY",CUENCA,AZUAY,4/2/2022,07:22:30,101,CUARTA_CLASE,2022-02-04,7,7,5,Ma√±ana,Viernes
AZUAY,CUENCA,#N/A,INTER PROVINCIAL,-3.072343333,-79063525,"VICTORIA DEL PORTETE,CUENCA,AZUAY",CUENCA,AZUAY,5/2/2022,10:42:33,103,CUARTA_CLASE,2022-02-05,10,10,6,Ma√±ana,S√°bado
AZUAY,CUENCA,#N/A,INTER PROVINCIAL,-3.313286667,-7986806667,"EL CAMBIO,MACHALA,EL ORO",CUENCA,AZUAY,5/2/2022,11:20:46,103,CUARTA_CLASE,2022-02-05,11,11,6,Ma√±ana,S√°bado
AZUAY,CUENCA,#N/A,INTER PROVINCIAL,-3.309083333,-79883015,"EL CAMBIO,MACHALA,EL ORO",CUENCA,AZUAY,5/2/2022,11:21:53,103,CUARTA_CLASE,2022-02-05,11,11,6,Ma√±ana,S√°bado
AZUAY,CUENCA,#N/A,INTER PROVINCIAL,-3.052646667,-7904810333,"VICTORIA DEL PORTETE,CUENCA,AZUAY",CUENCA,AZUAY,4/2/2022,15:17:53,105,CUARTA_CLASE,2022-02-04,15,15,5,Tarde,Viernes
AZUAY,CUENCA,#N/A,INTER PROVINCIAL,-3.08554,-7907773333,"VICTORIA DEL PORTETE,CUENCA,AZUAY",CUENCA,AZUAY,2/2/2022,07:34:46,101,CUARTA_CLASE,2022-02-02,7,7,3,Ma√±ana,Mi√©rcoles
AZUAY,CUENCA,#N/A,INTER PROVINCIAL,-3.057706667,-7905022167,"VICTORIA DEL PORTETE,CUENCA,AZUAY",CUENCA,AZUAY,2/2/2022,07:39:16,103,CUARTA_CLASE,2022-02-02,7,7,3,Ma√±ana,Mi√©rcoles
AZUAY,CUENCA,#N/A,INTER PROVINCIAL,-2.56762,-7954011333,"JESUS MARIA,NARANJAL,GUAYAS",CUENCA,AZUAY,2/2/2022,10:49:44,101,CUARTA_CLASE,2022-02-02,10,10,3,Ma√±ana,Mi√©rcoles
AZUAY,CUENCA,#N/A,INTER PROVINCIAL,-2.583021667,-7950390667,"JESUS MARIA,NARANJAL,GUAYAS",CUENCA,AZUAY,2/2/2022,10:52:47,103,CUARTA_CLASE,2022-02-02,10,10,3,Ma√±ana,Mi√©rcoles
AZUAY,CUENCA,#N/A,INTER PROVINCIAL,-2.585835,-7949209833,"JESUS MARIA,NARANJAL,GUAYAS",CUENCA,AZUAY,2/2/2022,10:53:35,103,CUARTA_CLASE,2022-02-02,10,10,3,Ma√±ana,Mi√©rcoles
AZUAY,CUENCA,#N/A,INTER PROVINCIAL,-2.570605,-7953515167,"JESUS MARIA,NARANJAL,GUAYAS",CUENCA,AZUAY,2/2/2022,17:17:57,105,CUARTA_CLASE,2022-02-02,17,17,3,Tarde,Mi√©rcoles
AZUAY,CUENCA,#N/A,INTER PROVINCIAL,-2.570923333,-79575915,"JESUS MARIA,NARANJAL,GUAYAS",CUENCA,AZUAY,2/2/2022,17:23:08,107,CUARTA_CLASE,2022-02-02,17,17,3,Tarde,Mi√©rcoles
AZUAY,CUENCA,#N/A,INTER PROVINCIAL,-2.603856667,-7961415667,"SANTA ROSA DE FLANDES,NARANJAL,GUAYAS",CUENCA,AZUAY,2/2/2022,17:29:13,107,CUARTA_CLASE,2022-02-02,17,17,3,Tarde,Mi√©rcoles
AZUAY,CUENCA,#N/A,INTER PROVINCIAL,-2.618435,-7962503667,"SANTA ROSA DE FLANDES,NARANJAL,GUAYAS",CUENCA,AZUAY,2/2/2022,17:30:33,101,CUARTA_CLASE,2022-02-02,17,17,3,Tarde,Mi√©rcoles
AZUAY,CUENCA,#N/A,INTER PROVINCIAL,-2.694443333,-7964496167,"NARANJAL,NARANJAL,GUAYAS",CUENCA,AZUAY,2/2/2022,17:59:17,101,CUARTA_CLASE,2022-02-02,17,17,3,Tarde,Mi√©rcoles
AZUAY,CUENCA,#N/A,INTER PROVINCIAL,-3.322025,-7983471667,"PASAJE,PASAJE,EL ORO",CUENCA,AZUAY,1/2/2022,18:55:12,105,CUARTA_CLASE,2022-02-01,18,18,2,Noche,Martes
AZUAY,CUENCA,#N/A,INTER PROVINCIAL,-3.301783333,-7989632833,"EL CAMBIO,MACHALA,EL ORO",CUENCA,AZUAY,1/2/2022,19:00:15,105,CUARTA_CLASE,2022-02-01,19,19,2,Noche,Martes
AZUAY,CUENCA,#N/A,INTER PROVINCIAL,-2.910833333,-7898315667,"CUENCA,CUENCA,AZUAY",CUENCA,AZUAY,1/2/2022,09:33:46,105,CUARTA_CLASE,2022-02-01,9,9,2,Ma√±ana,Martes
AZUAY,CUENCA,#N/A,INTER PROVINCIAL,-3.059768333,-7905106333,"VICTORIA DEL PORTETE,CUENCA,AZUAY",CUENCA,AZUAY,1/2/2022,10:37:59,103,CUARTA_CLASE,2022-02-01,10,10,2,Ma√±ana,Martes
AZUAY,CUENCA,#N/A,INTER PROVINCIAL,-3.086883333,-79078855,"VICTORIA DEL PORTETE,CUENCA,AZUAY",CUENCA,AZUAY,1/2/2022,10:41:16,101,CUARTA_CLASE,2022-02-01,10,10,2,Ma√±ana,Martes
AZUAY,CUENCA,#N/A,INTER PROVINCIAL,-3.310293333,-79623975,"PUCARA,PUCARA,AZUAY",CUENCA,AZUAY,1/2/2022,12:39:25,103,CUARTA_CLASE,2022-02-01,12,12,2,Tarde,Martes
AZUAY,CUENCA,#N/A,INTER PROVINCIAL,-3.306913333,-7989050167,"EL CAMBIO,MACHALA,EL ORO",CUENCA,AZUAY,2/2/2022,04:43:01,103,CUARTA_CLASE,2022-02-02,4,4,3,Madrugada,Mi√©rcoles
AZUAY,CUENCA,#N/A,INTER PROVINCIAL,-3.269126667,-7929332333,"SANTA ISABEL,SANTA ISABEL,AZUAY",CUENCA,AZUAY,2/2/2022,06:44:02,103,CUARTA_CLASE,2022-02-02,6,6,3,Ma√±ana,Mi√©rcoles
AZUAY,CUENCA,#N/A,INTER PROVINCIAL,-3.314061667,-7986369833,"LA PEA—A,PASAJE,EL ORO",CUENCA,AZUAY,11/2/2022,12:25:10,101,CUARTA_CLASE,2022-02-11,12,12,5,Tarde,Viernes
AZUAY,CUENCA,#N/A,INTER PROVINCIAL,-3.38359,-7991643333,"EL RETIRO,MACHALA,EL ORO",CUENCA,AZUAY,24/2/2022,00:23:12,107,CUARTA_CLASE,2022-02-24,0,0,4,Madrugada,Jueves
AZUAY,CUENCA,#N/A,INTER PROVINCIAL,-3.391396667,-7992959,"EL RETIRO,MACHALA,EL ORO",CUENCA,AZUAY,24/2/2022,00:24:07,103,CUARTA_CLASE,2022-02-24,0,0,4,Madrugada,Jueves
AZUAY,CUENCA,#N/A,INTER PROVINCIAL,-3.404198333,-7994778333,"EL RETIRO,MACHALA,EL ORO",CUENCA,AZUAY,24/2/2022,00:25:34,105,CUARTA_CLASE,2022-02-24,0,0,4,Madrugada,Jueves
AZUAY,CUENCA,#N/A,INTER PROVINCIAL,-2.91009,-7898238167,"CUENCA,CUENCA,AZUAY",CUENCA,AZUAY,11/2/2022,08:23:29,103,CUARTA_CLASE,2022-02-11,8,8,5,Ma√±ana,Viernes
AZUAY,CUENCA,#N/A,INTER PROVINCIAL,-3.320071667,-7971421833,"CASACAY,PASAJE,EL ORO",CUENCA,AZUAY,11/2/2022,11:24:16,101,CUARTA_CLASE,2022-02-11,11,11,5,Ma√±ana,Viernes
AZUAY,CUENCA,#N/A,INTER PROVINCIAL,-3.410211667,-79949895,"EL RETIRO,MACHALA,EL ORO",CUENCA,AZUAY,10/2/2022,13:56:08,101,CUARTA_CLASE,2022-02-10,13,13,4,Tarde,Jueves
AZUAY,CUENCA,#N/A,INTER PROVINCIAL,-3.310798333,-7962347333,"PUCARA,PUCARA,AZUAY",CUENCA,AZUAY,10/2/2022,14:20:30,103,CUARTA_CLASE,2022-02-10,14,14,4,Tarde,Jueves
AZUAY,CUENCA,#N/A,INTER PROVINCIAL,-3.36727,-7989556,"EL RETIRO,MACHALA,EL ORO",CUENCA,AZUAY,9/2/2022,16:57:07,103,CUARTA_CLASE,2022-02-09,16,16,3,Tarde,Mi√©rcoles
AZUAY,CUENCA,#N/A,INTER PROVINCIAL,-3.53499,-8016388833,"CHACRAS,ARENILLAS,EL ORO",CUENCA,AZUAY,10/2/2022,01:23:48,105,CUARTA_CLASE,2022-02-10,1,1,4,Madrugada,Jueves
AZUAY,CUENCA,#N/A,INTER PROVINCIAL,-3.310106667,-7962428667,"PUCARA,PUCARA,AZUAY",CUENCA,AZUAY,8/2/2022,09:07:30,101,CUARTA_CLASE,2022-02-08,9,9,2,Ma√±ana,Martes
AZUAY,CUENCA,#N/A,INTER PROVINCIAL,-3.094448333,-79089945,"VICTORIA DEL PORTETE,CUENCA,AZUAY",CUENCA,AZUAY,7/2/2022,15:56:34,105,CUARTA_CLASE,2022-02-07,15,15,1,Tarde,Lunes
AZUAY,CUENCA,#N/A,INTER PROVINCIAL,-3.312208333,-7950193833,"PUCARA,PUCARA,AZUAY",CUENCA,AZUAY,9/2/2022,10:08:30,103,CUARTA_CLASE,2022-02-09,10,10,3,Ma√±ana,Mi√©rcoles
AZUAY,CUENCA,#N/A,INTER PROVINCIAL,-3.307293333,-79888945,"EL CAMBIO,MACHALA,EL ORO",CUENCA,AZUAY,8/2/2022,18:08:08,103,CUARTA_CLASE,2022-02-08,18,18,2,Noche,Martes
AZUAY,CUENCA,#N/A,INTER PROVINCIAL,-3.308746667,-7988460667,"EL CAMBIO,MACHALA,EL ORO",CUENCA,AZUAY,9/2/2022,02:51:20,105,CUARTA_CLASE,2022-02-09,2,2,3,Madrugada,Mi√©rcoles
AZUAY,CUENCA,#N/A,INTER PROVINCIAL,-3.05871,-7905063,"VICTORIA DEL PORTETE,CUENCA,AZUAY",CUENCA,AZUAY,9/2/2022,05:25:23,101,CUARTA_CLASE,2022-02-09,5,5,3,Madrugada,Mi√©rcoles
AZUAY,CUENCA,#N/A,INTER PROVINCIAL,-2.920881667,-7901705167,"CUENCA,CUENCA,AZUAY",CUENCA,AZUAY,9/2/2022,05:42:53,109,CUARTA_CLASE,2022-02-09,5,5,3,Madrugada,Mi√©rcoles
AZUAY,CUENCA,#N/A,INTER PROVINCIAL,-2.572248333,-79577435,"JESUS MARIA,NARANJAL,GUAYAS",CUENCA,AZUAY,8/2/2022,14:16:48,101,CUARTA_CLASE,2022-02-08,14,14,2,Tarde,Martes
AZUAY,CUENCA,#N/A,INTER PROVINCIAL,-3.481475,-7997851333,"SANTA ROSA,SANTA ROSA,EL ORO",CUENCA,AZUAY,9/2/2022,17:21:49,105,CUARTA_CLASE,2022-02-09,17,17,3,Tarde,Mi√©rcoles
AZUAY,CUENCA,#N/A,INTER PROVINCIAL,-3.072868333,-7906451667,"VICTORIA DEL PORTETE,CUENCA,AZUAY",CUENCA,AZUAY,9/2/2022,13:59:47,103,CUARTA_CLASE,2022-02-09,13,13,3,Tarde,Mi√©rcoles
AZUAY,CUENCA,#N/A,INTER PROVINCIAL,-3.325731667,-79362035,"SANTA ISABEL,SANTA ISABEL,AZUAY",CUENCA,AZUAY,9/2/2022,07:52:40,105,CUARTA_CLASE,2022-02-09,7,7,3,Ma√±ana,Mi√©rcoles
AZUAY,CUENCA,#N/A,INTER PROVINCIAL,-3.509213333,-8019861333,"CHACRAS,ARENILLAS,EL ORO",CUENCA,AZUAY,6/2/2022,15:20:55,101,CUARTA_CLASE,2022-02-06,15,15,7,Tarde,Domingo
AZUAY,CUENCA,#N/A,INTER PROVINCIAL,-3.527651667,-8018649167,"CHACRAS,ARENILLAS,EL ORO",CUENCA,AZUAY,6/2/2022,15:22:22,101,CUARTA_CLASE,2022-02-06,15,15,7,Tarde,Domingo
AZUAY,CUENCA,#N/A,INTER PROVINCIAL,-3.534931667,-8016441,"CHACRAS,ARENILLAS,EL ORO",CUENCA,AZUAY,6/2/2022,15:27:02,101,CUARTA_CLASE,2022-02-06,15,15,7,Tarde,Domingo
AZUAY,CUENCA,#N/A,INTER PROVINCIAL,-3.546978333,-8010629333,"ARENILLAS,ARENILLAS,EL ORO",CUENCA,AZUAY,6/2/2022,15:31:39,105,CUARTA_CLASE,2022-02-06,15,15,7,Tarde,Domingo
AZUAY,CUENCA,#N/A,INTER PROVINCIAL,-3.555716667,-8003572833,"ARENILLAS,ARENILLAS,EL ORO",CUENCA,AZUAY,6/2/2022,15:46:03,103,CUARTA_CLASE,2022-02-06,15,15,7,Tarde,Domingo
AZUAY,CUENCA,#N/A,INTER PROVINCIAL,-3.544055,-8002921333,"SAN ANTONIO,SANTA ROSA,EL ORO",CUENCA,AZUAY,6/2/2022,15:47:02,101,CUARTA_CLASE,2022-02-06,15,15,7,Tarde,Domingo
AZUAY,CUENCA,#N/A,INTER PROVINCIAL,-3.539213333,-8002010167,"SAN ANTONIO,SANTA ROSA,EL ORO",CUENCA,AZUAY,6/2/2022,15:47:41,105,CUARTA_CLASE,2022-02-06,15,15,7,Tarde,Domingo
AZUAY,CUENCA,#N/A,INTER PROVINCIAL,-3.505288333,-79979885,"BELLAVISTA,SANTA ROSA,EL ORO",CUENCA,AZUAY,6/2/2022,15:52:19,101,CUARTA_CLASE,2022-02-06,15,15,7,Tarde,Domingo
AZUAY,CUENCA,#N/A,INTER PROVINCIAL,-3.487553333,-79978775,"SANTA ROSA,SANTA ROSA,EL ORO",CUENCA,AZUAY,6/2/2022,15:53:30,103,CUARTA_CLASE,2022-02-06,15,15,7,Tarde,Domingo
AZUAY,CUENCA,#N/A,INTER PROVINCIAL,-3.457896667,-7997691667,"SANTA ROSA,SANTA ROSA,EL ORO",CUENCA,AZUAY,6/2/2022,15:55:38,105,CUARTA_CLASE,2022-02-06,15,15,7,Tarde,Domingo
AZUAY,CUENCA,#N/A,INTER PROVINCIAL,-3.440286667,-7997311,"SANTA ROSA,SANTA ROSA,EL ORO",CUENCA,AZUAY,6/2/2022,15:57:09,101,CUARTA_CLASE,2022-02-06,15,15,7,Tarde,Domingo
AZUAY,CUENCA,#N/A,INTER PROVINCIAL,-3.308873333,-79884135,"EL CAMBIO,MACHALA,EL ORO",CUENCA,AZUAY,6/2/2022,17:50:59,101,CUARTA_CLASE,2022-02-06,17,17,7,Tarde,Domingo
AZUAY,CUENCA,#N/A,INTER PROVINCIAL,-3.3179,-7985088,"LA PEA—A,PASAJE,EL ORO",CUENCA,AZUAY,6/2/2022,17:53:13,103,CUARTA_CLASE,2022-02-06,17,17,7,Tarde,Domingo
AZUAY,CUENCA,#N/A,INTER PROVINCIAL,-3.066998333,-7905664167,"VICTORIA DEL PORTETE,CUENCA,AZUAY",CUENCA,AZUAY,6/2/2022,21:03:30,107,CUARTA_CLASE,2022-02-06,21,21,7,Noche,Domingo
AZUAY,CUENCA,#N/A,INTER PROVINCIAL,-3.322321667,-7983422667,"PASAJE,PASAJE,EL ORO",CUENCA,AZUAY,7/2/2022,22:15:56,103,CUARTA_CLASE,2022-02-07,22,22,1,Noche,Lunes
AZUAY,CUENCA,#N/A,INTER PROVINCIAL,-2.569581667,-7953674,"JESUS MARIA,NARANJAL,GUAYAS",CUENCA,AZUAY,7/2/2022,10:58:31,103,CUARTA_CLASE,2022-02-07,10,10,1,Ma√±ana,Lunes
AZUAY,CUENCA,#N/A,INTER PROVINCIAL,-3.308666667,-7988440833,"EL CAMBIO,MACHALA,EL ORO",CUENCA,AZUAY,7/2/2022,12:06:57,103,CUARTA_CLASE,2022-02-07,12,12,1,Tarde,Lunes
AZUAY,CUENCA,#N/A,INTER PROVINCIAL,-3.304983333,-7989272167,"EL CAMBIO,MACHALA,EL ORO",CUENCA,AZUAY,7/2/2022,12:07:33,105,CUARTA_CLASE,2022-02-07,12,12,1,Tarde,Lunes
AZUAY,CUENCA,#N/A,INTER PROVINCIAL,-3.290695,-7990871167,"EL CAMBIO,MACHALA,EL ORO",CUENCA,AZUAY,7/2/2022,12:09:21,103,CUARTA_CLASE,2022-02-07,12,12,1,Tarde,Lunes
AZUAY,CUENCA,#N/A,INTER PROVINCIAL,-3.053726667,-7904855667,"VICTORIA DEL PORTETE,CUENCA,AZUAY",CUENCA,AZUAY,8/2/2022,15:02:52,101,CUARTA_CLASE,2022-02-08,15,15,2,Tarde,Martes
AZUAY,CUENCA,#N/A,INTER PROVINCIAL,-3.303045,-79895095,"EL CAMBIO,MACHALA,EL ORO",CUENCA,AZUAY,8/2/2022,06:54:42,105,CUARTA_CLASE,2022-02-08,6,6,2,Ma√±ana,Martes
AZUAY,CUENCA,#N/A,INTER PROVINCIAL,-3.310565,-7987860667,"EL CAMBIO,MACHALA,EL ORO",CUENCA,AZUAY,8/2/2022,06:56:05,103,CUARTA_CLASE,2022-02-08,6,6,2,Ma√±ana,Martes
AZUAY,CUENCA,#N/A,INTER PROVINCIAL,-3.314351667,-7986109167,"LA PEA—A,PASAJE,EL ORO",CUENCA,AZUAY,6/2/2022,09:53:46,105,CUARTA_CLASE,2022-02-06,9,9,7,Ma√±ana,Domingo
AZUAY,CUENCA,#N/A,INTER PROVINCIAL,-3.312695,-7987108,"EL CAMBIO,MACHALA,EL ORO",CUENCA,AZUAY,6/2/2022,09:54:26,101,CUARTA_CLASE,2022-02-06,9,9,7,Ma√±ana,Domingo
AZUAY,CUENCA,#N/A,INTER PROVINCIAL,-3.544026667,-80029485,"SAN ANTONIO,SANTA ROSA,EL ORO",CUENCA,AZUAY,6/2/2022,10:05:51,101,CUARTA_CLASE,2022-02-06,10,10,7,Ma√±ana,Domingo
AZUAY,CUENCA,#N/A,INTER PROVINCIAL,-2.920828333,-7901733833,"CUENCA,CUENCA,AZUAY",CUENCA,AZUAY,6/2/2022,11:45:08,103,CUARTA_CLASE,2022-02-06,11,11,7,Ma√±ana,Domingo
AZUAY,CUENCA,#N/A,INTER PROVINCIAL,-3.318543333,-79652545,"PUCARA,PUCARA,AZUAY",CUENCA,AZUAY,5/2/2022,12:25:50,105,CUARTA_CLASE,2022-02-05,12,12,6,Tarde,S√°bado
AZUAY,CUENCA,#N/A,INTER PROVINCIAL,-3.291038333,-7990856833,"EL CAMBIO,MACHALA,EL ORO",CUENCA,AZUAY,5/2/2022,14:22:53,101,CUARTA_CLASE,2022-02-05,14,14,6,Tarde,S√°bado
AZUAY,CUENCA,#N/A,INTER PROVINCIAL,-3.185876667,-7917082,"GIRON,GIRON,AZUAY",CUENCA,AZUAY,6/2/2022,04:25:25,103,CUARTA_CLASE,2022-02-06,4,4,7,Madrugada,Domingo
AZUAY,CUENCA,#N/A,INTER PROVINCIAL,-3.072041667,-7906291667,"VICTORIA DEL PORTETE,CUENCA,AZUAY",CUENCA,AZUAY,6/2/2022,11:45:41,101,CUARTA_CLASE,2022-02-06,11,11,7,Ma√±ana,Domingo
AZUAY,CUENCA,#N/A,INTER PROVINCIAL,-2.924076667,-79035505,"TURI,CUENCA,AZUAY",CUENCA,AZUAY,6/2/2022,11:46:55,105,CUARTA_CLASE,2022-02-06,11,11,7,Ma√±ana,Domingo
AZUAY,CUENCA,#N/A,INTER PROVINCIAL,-3.138261667,-7913613667,"GIRON,GIRON,AZUAY",CUENCA,AZUAY,6/2/2022,11:59:21,103,CUARTA_CLASE,2022-02-06,11,11,7,Ma√±ana,Domingo
AZUAY,CUENCA,#N/A,INTER PROVINCIAL,-3.325721667,-7936108833,"SANTA ISABEL,SANTA ISABEL,AZUAY",CUENCA,AZUAY,6/2/2022,12:47:13,101,CUARTA_CLASE,2022-02-06,12,12,7,Tarde,Domingo
AZUAY,CUENCA,#N/A,INTER PROVINCIAL,-3.32666,-79365895,"SANTA ISABEL,SANTA ISABEL,AZUAY",CUENCA,AZUAY,6/2/2022,12:47:33,105,CUARTA_CLASE,2022-02-06,12,12,7,Tarde,Domingo
AZUAY,CUENCA,#N/A,INTER PROVINCIAL,-3.503125,-8020257167,"CHACRAS,ARENILLAS,EL ORO",CUENCA,AZUAY,6/2/2022,15:20:26,105,CUARTA_CLASE,2022-02-06,15,15,7,Tarde,Domingo
AZUAY,CUENCA,#N/A,INTER PROVINCIAL,-3.31102,-7962328667,"PUCARA,PUCARA,AZUAY",CUENCA,AZUAY,6/2/2022,09:15:04,105,CUARTA_CLASE,2022-02-06,9,9,7,Ma√±ana,Domingo
AZUAY,CUENCA,#N/A,INTER PROVINCIAL,-3.313951667,-79863825,"LA PEA—A,PASAJE,EL ORO",CUENCA,AZUAY,6/2/2022,09:17:56,101,CUARTA_CLASE,2022-02-06,9,9,7,Ma√±ana,Domingo
AZUAY,CUENCA,#N/A,INTER PROVINCIAL,-3.313043333,-7986974833,"EL CAMBIO,MACHALA,EL ORO",CUENCA,AZUAY,6/2/2022,09:18:20,103,CUARTA_CLASE,2022-02-06,9,9,7,Ma√±ana,Domingo
AZUAY,CUENCA,#N/A,INTER PROVINCIAL,-3.30758,-7988796833,"EL CAMBIO,MACHALA,EL ORO",CUENCA,AZUAY,6/2/2022,09:19:44,101,CUARTA_CLASE,2022-02-06,9,9,7,Ma√±ana,Domingo
AZUAY,CUENCA,#N/A,INTER PROVINCIAL,-3.304015,-7989378,"EL CAMBIO,MACHALA,EL ORO",CUENCA,AZUAY,6/2/2022,09:20:12,105,CUARTA_CLASE,2022-02-06,9,9,7,Ma√±ana,Domingo
AZUAY,CUENCA,#N/A,INTER PROVINCIAL,-3.300185,-79898285,"EL CAMBIO,MACHALA,EL ORO",CUENCA,AZUAY,6/2/2022,09:33:15,103,CUARTA_CLASE,2022-02-06,9,9,7,Ma√±ana,Domingo
AZUAY,CUENCA,#N/A,INTER PROVINCIAL,-3.42125,-7995375,"EL RETIRO,MACHALA,EL ORO",CUENCA,AZUAY,6/2/2022,09:45:15,101,CUARTA_CLASE,2022-02-06,9,9,7,Ma√±ana,Domingo
AZUAY,CUENCA,#N/A,INTER PROVINCIAL,-2.920628333,-7901589667,"CUENCA,CUENCA,AZUAY",CUENCA,AZUAY,3/2/2022,14:32:11,105,CUARTA_CLASE,2022-02-03,14,14,4,Tarde,Jueves
AZUAY,CUENCA,#N/A,INTER PROVINCIAL,-2.465691667,-7901063333,"ZHUD,CA—AR",CUENCA,AZUAY,3/2/2022,10:42:37,101,CUARTA_CLASE,2022-02-03,10,10,4,Ma√±ana,Jueves
AZUAY,CUENCA,#N/A,INTER PROVINCIAL,-2.521555,-78927305,"EL TAMBO,EL TAMBO,CA—AR",CUENCA,AZUAY,10/2/2022,06:21:00,105,CUARTA_CLASE,2022-02-10,6,6,4,Ma√±ana,Jueves
AZUAY,CUENCA,#N/A,INTER PROVINCIAL,-2.920961667,-79018215,"CUENCA,CUENCA,AZUAY",CUENCA,AZUAY,1/2/2022,17:45:23,105,CUARTA_CLASE,2022-02-01,17,17,2,Tarde,Martes
AZUAY,CUENCA,#N/A,INTER PROVINCIAL,-2.398598333,-7816545167,"SANTA MARIANITA DE JESUS,SUCUA,MORONA SANTIAGO",CUENCA,AZUAY,1/2/2022,17:59:31,101,CUARTA_CLASE,2022-02-01,17,17,2,Tarde,Martes
AZUAY,CUENCA,#N/A,INTER PROVINCIAL,-1.743035,-7785580333,"SIMON BOLIVAR,PASTAZA",CUENCA,AZUAY,2/2/2022,18:44:42,103,CUARTA_CLASE,2022-02-02,18,18,3,Noche,Mi√©rcoles
AZUAY,CUENCA,#N/A,INTER PROVINCIAL,-2.840256667,-7887733,"LLACAO,CUENCA,AZUAY",CUENCA,AZUAY,2/2/2022,12:12:24,101,CUARTA_CLASE,2022-02-02,12,12,3,Tarde,Mi√©rcoles
AZUAY,CUENCA,#N/A,INTER PROVINCIAL,-2.846756667,-7889023167,"NULTI,CUENCA,AZUAY",CUENCA,AZUAY,2/2/2022,12:13:31,101,CUARTA_CLASE,2022-02-02,12,12,3,Tarde,Mi√©rcoles
AZUAY,CUENCA,#N/A,INTER PROVINCIAL,-2.846775,-7889029167,"NULTI,CUENCA,AZUAY",CUENCA,AZUAY,2/2/2022,01:04:45,103,CUARTA_CLASE,2022-02-02,1,1,3,Madrugada,Mi√©rcoles
AZUAY,CUENCA,#N/A,INTER PROVINCIAL,-2.852603333,-7890729833,"NULTI,CUENCA,AZUAY",CUENCA,AZUAY,2/2/2022,01:06:00,101,CUARTA_CLASE,2022-02-02,1,1,3,Madrugada,Mi√©rcoles
AZUAY,CUENCA,#N/A,INTER PROVINCIAL,-2.887336667,-7895110833,"CUENCA,CUENCA,AZUAY",CUENCA,AZUAY,2/2/2022,04:17:26,101,CUARTA_CLASE,2022-02-02,4,4,3,Madrugada,Mi√©rcoles
AZUAY,CUENCA,#N/A,INTER PROVINCIAL,-2.8548966670000002,-78918095,"CUENCA,CUENCA,AZUAY",CUENCA,AZUAY,2/2/2022,04:20:55,103,CUARTA_CLASE,2022-02-02,4,4,3,Madrugada,Mi√©rcoles
AZUAY,CUENCA,#N/A,INTER PROVINCIAL,-2.870095,-789371,"CUENCA,CUENCA,AZUAY",CUENCA,AZUAY,1/2/2022,10:29:51,103,CUARTA_CLASE,2022-02-01,10,10,2,Ma√±ana,Martes
AZUAY,CUENCA,#N/A,INTER PROVINCIAL,-2.852761667,-7890763167,"NULTI,CUENCA,AZUAY",CUENCA,AZUAY,1/2/2022,10:32:26,103,CUARTA_CLASE,2022-02-01,10,10,2,Ma√±ana,Martes
AZUAY,CUENCA,#N/A,INTER PROVINCIAL,-2.847871667,-78893405,"NULTI,CUENCA,AZUAY",CUENCA,AZUAY,1/2/2022,10:33:28,101,CUARTA_CLASE,2022-02-01,10,10,2,Ma√±ana,Martes
AZUAY,CUENCA,#N/A,INTER PROVINCIAL,-2.850941667,-7890198,"NULTI,CUENCA,AZUAY",CUENCA,AZUAY,2/2/2022,04:22:06,101,CUARTA_CLASE,2022-02-02,4,4,3,Madrugada,Mi√©rcoles
AZUAY,CUENCA,#N/A,INTER PROVINCIAL,-0.96434,-78645285,"LATACUNGA,LATACUNGA,COTOPAXI",CUENCA,AZUAY,10/2/2022,06:02:32,103,CUARTA_CLASE,2022-02-10,6,6,4,Ma√±ana,Jueves
AZUAY,CUENCA,#N/A,INTER PROVINCIAL,-0.4817,-7856843833,"ALOAG,MEJIA,PICHINCHA",CUENCA,AZUAY,8/2/2022,21:22:36,103,CUARTA_CLASE,2022-02-08,21,21,2,Noche,Martes
AZUAY,CUENCA,#N/A,INTER PROVINCIAL,-2.913728333,-7898573667,"CUENCA,CUENCA,AZUAY",CUENCA,AZUAY,8/2/2022,14:36:56,105,CUARTA_CLASE,2022-02-08,14,14,2,Tarde,Martes
AZUAY,CUENCA,#N/A,INTER PROVINCIAL,-2.297956667,-7949395833,"EL TRIUNFO,EL TRIUNFO,GUAYAS",CUENCA,AZUAY,6/2/2022,15:36:20,101,CUARTA_CLASE,2022-02-06,15,15,7,Tarde,Domingo
AZUAY,CUENCA,#N/A,INTER PROVINCIAL,-2.28283,-7951689667,"EL TRIUNFO,EL TRIUNFO,GUAYAS",CUENCA,AZUAY,6/2/2022,17:12:41,101,CUARTA_CLASE,2022-02-06,17,17,7,Tarde,Domingo
AZUAY,CUENCA,#N/A,INTER PROVINCIAL,-2.720931667,-7888955333,"BIBLIAN,BIBLIAN,CA—AR",CUENCA,AZUAY,6/2/2022,20:40:13,101,CUARTA_CLASE,2022-02-06,20,20,7,Noche,Domingo
AZUAY,CUENCA,#N/A,INTER PROVINCIAL,-2.853063333,-7890940833,"NULTI,CUENCA,AZUAY",CUENCA,AZUAY,8/2/2022,05:44:02,103,CUARTA_CLASE,2022-02-08,5,5,2,Madrugada,Martes
AZUAY,CUENCA,#N/A,INTER PROVINCIAL,-2.800863333,-7888054167,"JAVIER LOYOLA,AZOGUES,CA—AR",CUENCA,AZUAY,5/2/2022,00:51:34,101,CUARTA_CLASE,2022-02-05,0,0,6,Madrugada,S√°bado
AZUAY,CUENCA,#N/A,INTER PROVINCIAL,-2.88608,-7894914,"CUENCA,CUENCA,AZUAY",CUENCA,AZUAY,5/2/2022,01:01:08,101,CUARTA_CLASE,2022-02-05,1,1,6,Madrugada,S√°bado
AZUAY,CUENCA,#N/A,INTER PROVINCIAL,-2.10341,-78748625,"TIXAN,ALAUSI,CHIMBORAZO",CUENCA,AZUAY,11/2/2022,17:51:34,114,CUARTA_CLASE,2022-02-11,17,17,5,Tarde,Viernes
AZUAY,CUENCA,#N/A,INTER PROVINCIAL,-2.478123333,-7897710167,"JUNCAL,CA—AR",CUENCA,AZUAY,4/2/2022,12:07:16,101,CUARTA_CLASE,2022-02-04,12,12,5,Tarde,Viernes
AZUAY,CUENCA,#N/A,INTER PROVINCIAL,-3.19581,-7902694,"GIRON,GIRON,AZUAY",CUENCA,AZUAY,2/2/2022,12:46:58,103,CUARTA_CLASE,2022-02-02,12,12,3,Tarde,Mi√©rcoles
AZUAY,CUENCA,#N/A,INTER PROVINCIAL,-2.807838333,-7888232667,"JAVIER LOYOLA,AZOGUES,CA—AR",CUENCA,AZUAY,3/2/2022,22:56:35,103,CUARTA_CLASE,2022-02-03,22,22,4,Noche,Jueves
AZUAY,CUENCA,#N/A,INTER PROVINCIAL,-1.80506,-7874028,"VILLA LA UNION,COLTA,CHIMBORAZO",CUENCA,AZUAY,3/2/2022,02:50:13,107,CUARTA_CLASE,2022-02-03,2,2,4,Madrugada,Jueves
AZUAY,CUENCA,#N/A,INTER PROVINCIAL,-1.648953333,-787413,"CALPI,RIOBAMBA,CHIMBORAZO",CUENCA,AZUAY,3/2/2022,03:06:28,109,CUARTA_CLASE,2022-02-03,3,3,4,Madrugada,Jueves
AZUAY,CUENCA,#N/A,INTER PROVINCIAL,-1.240588333,-7859032333,"AMBATO,AMBATO,TUNGURAHUA",CUENCA,AZUAY,3/2/2022,04:10:14,107,CUARTA_CLASE,2022-02-03,4,4,4,Madrugada,Jueves
AZUAY,CUENCA,#N/A,INTER PROVINCIAL,-0.953616667,-7865163167,"LATACUNGA,LATACUNGA,COTOPAXI",CUENCA,AZUAY,3/2/2022,04:36:36,109,CUARTA_CLASE,2022-02-03,4,4,4,Madrugada,Jueves
AZUAY,CUENCA,#N/A,INTER PROVINCIAL,-3.348565,-7918344833,"LAS NIEVES,NABON,AZUAY",CUENCA,AZUAY,3/2/2022,08:52:37,105,CUARTA_CLASE,2022-02-03,8,8,4,Ma√±ana,Jueves
AZUAY,CUENCA,#N/A,INTER PROVINCIAL,-3.325935,-7916782833,"LAS NIEVES,NABON,AZUAY",CUENCA,AZUAY,3/2/2022,08:54:35,101,CUARTA_CLASE,2022-02-03,8,8,4,Ma√±ana,Jueves
AZUAY,CUENCA,#N/A,INTER PROVINCIAL,-3.072025,-7902242,"CUMBE,CUENCA,AZUAY",CUENCA,AZUAY,1/2/2022,00:03:04,105,CUARTA_CLASE,2022-02-01,0,0,2,Madrugada,Martes
AZUAY,CUENCA,#N/A,INTER PROVINCIAL,-3.063345,-7903187333,"CUMBE,CUENCA,AZUAY",CUENCA,AZUAY,1/2/2022,00:03:54,105,CUARTA_CLASE,2022-02-01,0,0,2,Madrugada,Martes
AZUAY,CUENCA,#N/A,INTER PROVINCIAL,-3.058358333,-79035945,"CUMBE,CUENCA,AZUAY",CUENCA,AZUAY,1/2/2022,00:04:20,105,CUARTA_CLASE,2022-02-01,0,0,2,Madrugada,Martes
AZUAY,CUENCA,#N/A,INTER PROVINCIAL,-3.229243333,-7904269,"NABON,NABON,AZUAY",CUENCA,AZUAY,1/2/2022,06:09:44,107,CUARTA_CLASE,2022-02-01,6,6,2,Ma√±ana,Martes
AZUAY,CUENCA,#N/A,INTER PROVINCIAL,-3.290515,-7910378833,"NABON,NABON,AZUAY",CUENCA,AZUAY,1/2/2022,06:18:45,105,CUARTA_CLASE,2022-02-01,6,6,2,Ma√±ana,Martes
AZUAY,CUENCA,#N/A,INTER PROVINCIAL,-3.29936,-7911163833,"LAS NIEVES,NABON,AZUAY",CUENCA,AZUAY,1/2/2022,06:19:33,105,CUARTA_CLASE,2022-02-01,6,6,2,Ma√±ana,Martes
AZUAY,CUENCA,#N/A,INTER PROVINCIAL,-3.332025,-7917272667,"LAS NIEVES,NABON,AZUAY",CUENCA,AZUAY,1/2/2022,06:28:35,103,CUARTA_CLASE,2022-02-01,6,6,2,Ma√±ana,Martes
AZUAY,CUENCA,#N/A,INTER PROVINCIAL,-3.342331667,-7917944167,"LAS NIEVES,NABON,AZUAY",CUENCA,AZUAY,1/2/2022,06:29:30,103,CUARTA_CLASE,2022-02-01,6,6,2,Ma√±ana,Martes
AZUAY,CUENCA,#N/A,INTER PROVINCIAL,-3.3559,-7918883333,"LAS NIEVES,NABON,AZUAY",CUENCA,AZUAY,2/2/2022,13:11:46,105,CUARTA_CLASE,2022-02-02,13,13,3,Tarde,Mi√©rcoles
AZUAY,CUENCA,#N/A,INTER PROVINCIAL,-0.80974,-7862380333,"TANICUCHI,LATACUNGA,COTOPAXI",CUENCA,AZUAY,10/2/2022,04:50:28,105,CUARTA_CLASE,2022-02-10,4,4,4,Madrugada,Jueves
AZUAY,CUENCA,#N/A,INTER PROVINCIAL,-0.781148333,-78610375,"TANICUCHI,LATACUNGA,COTOPAXI",CUENCA,AZUAY,10/2/2022,04:52:35,105,CUARTA_CLASE,2022-02-10,4,4,4,Madrugada,Jueves
AZUAY,CUENCA,#N/A,INTER PROVINCIAL,-0.731208333,-7860929667,"SAN JUAN DE PASTOCALLE,LATACUNGA,COTOPAXI",CUENCA,AZUAY,10/2/2022,04:55:59,105,CUARTA_CLASE,2022-02-10,4,4,4,Madrugada,Jueves
AZUAY,CUENCA,#N/A,INTER PROVINCIAL,-0.715246667,-7860023667,"SAN JUAN DE PASTOCALLE,LATACUNGA,COTOPAXI",CUENCA,AZUAY,10/2/2022,04:57:10,107,CUARTA_CLASE,2022-02-10,4,4,4,Madrugada,Jueves
AZUAY,CUENCA,#N/A,INTER PROVINCIAL,-0.695238333,-7858816833,"SAN JUAN DE PASTOCALLE,LATACUNGA,COTOPAXI",CUENCA,AZUAY,10/2/2022,04:58:37,105,CUARTA_CLASE,2022-02-10,4,4,4,Madrugada,Jueves
AZUAY,CUENCA,#N/A,INTER PROVINCIAL,-0.577721667,-7860111,"ALOASI,MEJIA,PICHINCHA",CUENCA,AZUAY,10/2/2022,05:09:59,105,CUARTA_CLASE,2022-02-10,5,5,4,Madrugada,Jueves
AZUAY,CUENCA,#N/A,INTER PROVINCIAL,-0.526545,-7857916167,"ALOASI,MEJIA,PICHINCHA",CUENCA,AZUAY,10/2/2022,05:17:20,103,CUARTA_CLASE,2022-02-10,5,5,4,Madrugada,Jueves
AZUAY,CUENCA,#N/A,INTER PROVINCIAL,-0.484521667,-7856905,"ALOASI,MEJIA,PICHINCHA",CUENCA,AZUAY,10/2/2022,05:20:55,101,CUARTA_CLASE,2022-02-10,5,5,4,Madrugada,Jueves
AZUAY,CUENCA,#N/A,INTER PROVINCIAL,-3.357516667,-7918999,"LAS NIEVES,NABON,AZUAY",CUENCA,AZUAY,9/2/2022,21:11:56,103,CUARTA_CLASE,2022-02-09,21,21,3,Noche,Mi√©rcoles
AZUAY,CUENCA,#N/A,INTER PROVINCIAL,-3.349008333,-7918373,"LAS NIEVES,NABON,AZUAY",CUENCA,AZUAY,9/2/2022,21:12:39,101,CUARTA_CLASE,2022-02-09,21,21,3,Noche,Mi√©rcoles
AZUAY,CUENCA,#N/A,INTER PROVINCIAL,-3.345215,-79181125,"LAS NIEVES,NABON,AZUAY",CUENCA,AZUAY,9/2/2022,21:12:56,105,CUARTA_CLASE,2022-02-09,21,21,3,Noche,Mi√©rcoles
AZUAY,CUENCA,#N/A,INTER PROVINCIAL,-3.326913333,-7916853333,"LAS NIEVES,NABON,AZUAY",CUENCA,AZUAY,9/2/2022,21:14:34,103,CUARTA_CLASE,2022-02-09,21,21,3,Noche,Mi√©rcoles
AZUAY,CUENCA,#N/A,INTER PROVINCIAL,-3.067775,-7902670167,"CUMBE,CUENCA,AZUAY",CUENCA,AZUAY,9/2/2022,21:51:39,105,CUARTA_CLASE,2022-02-09,21,21,3,Noche,Mi√©rcoles
AZUAY,CUENCA,#N/A,INTER PROVINCIAL,-3.05609,-7903684667,"CUMBE,CUENCA,AZUAY",CUENCA,AZUAY,9/2/2022,21:52:42,103,CUARTA_CLASE,2022-02-09,21,21,3,Noche,Mi√©rcoles
AZUAY,CUENCA,#N/A,INTER PROVINCIAL,-2.877618333,-78942105,"CUENCA,CUENCA,AZUAY",CUENCA,AZUAY,9/2/2022,23:02:34,101,CUARTA_CLASE,2022-02-09,23,23,3,Noche,Mi√©rcoles
AZUAY,CUENCA,#N/A,INTER PROVINCIAL,-2.114195,-7875022833,"TIXAN,ALAUSI,CHIMBORAZO",CUENCA,AZUAY,10/2/2022,02:20:25,103,CUARTA_CLASE,2022-02-10,2,2,4,Madrugada,Jueves
AZUAY,CUENCA,#N/A,INTER PROVINCIAL,-2.067428333,-7873950333,"PALMIRA,GUAMOTE,CHIMBORAZO",CUENCA,AZUAY,10/2/2022,02:24:34,101,CUARTA_CLASE,2022-02-10,2,2,4,Madrugada,Jueves
AZUAY,CUENCA,#N/A,INTER PROVINCIAL,-1.997636667,-7872686167,"GUAMOTE,GUAMOTE,CHIMBORAZO",CUENCA,AZUAY,10/2/2022,02:29:14,103,CUARTA_CLASE,2022-02-10,2,2,4,Madrugada,Jueves
AZUAY,CUENCA,#N/A,INTER PROVINCIAL,-1.984591667,-78726365,"GUAMOTE,GUAMOTE,CHIMBORAZO",CUENCA,AZUAY,10/2/2022,02:30:08,103,CUARTA_CLASE,2022-02-10,2,2,4,Madrugada,Jueves
AZUAY,CUENCA,#N/A,INTER PROVINCIAL,-1.959863333,-78716815,"GUAMOTE,GUAMOTE,CHIMBORAZO",CUENCA,AZUAY,10/2/2022,02:32:13,101,CUARTA_CLASE,2022-02-10,2,2,4,Madrugada,Jueves
AZUAY,CUENCA,#N/A,INTER PROVINCIAL,-1.914218333,-7871618,"COLUMBE,COLTA,CHIMBORAZO",CUENCA,AZUAY,10/2/2022,02:39:23,107,CUARTA_CLASE,2022-02-10,2,2,4,Madrugada,Jueves
AZUAY,CUENCA,#N/A,INTER PROVINCIAL,-1.897603333,-7871619667,"COLUMBE,COLTA,CHIMBORAZO",CUENCA,AZUAY,10/2/2022,02:40:34,107,CUARTA_CLASE,2022-02-10,2,2,4,Madrugada,Jueves
AZUAY,CUENCA,#N/A,INTER PROVINCIAL,-1.878981667,-7871475167,"COLUMBE,COLTA,CHIMBORAZO",CUENCA,AZUAY,10/2/2022,02:41:59,103,CUARTA_CLASE,2022-02-10,2,2,4,Madrugada,Jueves
AZUAY,CUENCA,#N/A,INTER PROVINCIAL,-3.196006667,-7902706167,"GIRON,GIRON,AZUAY",CUENCA,AZUAY,9/2/2022,11:21:17,101,CUARTA_CLASE,2022-02-09,11,11,3,Ma√±ana,Mi√©rcoles
AZUAY,CUENCA,#N/A,INTER PROVINCIAL,-3.544555,-7917908,"EL TABLON,SARAGURO,LOJA",CUENCA,AZUAY,8/2/2022,11:10:31,107,CUARTA_CLASE,2022-02-08,11,11,2,Ma√±ana,Martes
AZUAY,CUENCA,#N/A,INTER PROVINCIAL,-3.528536667,-7917448667,"EL TABLON,SARAGURO,LOJA",CUENCA,AZUAY,8/2/2022,11:12:27,103,CUARTA_CLASE,2022-02-08,11,11,2,Ma√±ana,Martes
AZUAY,CUENCA,#N/A,INTER PROVINCIAL,-3.522646667,-7917253667,"EL TABLON,SARAGURO,LOJA",CUENCA,AZUAY,8/2/2022,11:12:53,103,CUARTA_CLASE,2022-02-08,11,11,2,Ma√±ana,Martes
AZUAY,CUENCA,#N/A,INTER PROVINCIAL,-3.360506667,-7919248,"LAS NIEVES,NABON,AZUAY",CUENCA,AZUAY,8/2/2022,11:57:48,107,CUARTA_CLASE,2022-02-08,11,11,2,Ma√±ana,Martes
AZUAY,CUENCA,#N/A,INTER PROVINCIAL,-3.289108333,-7910235667,"NABON,NABON,AZUAY",CUENCA,AZUAY,8/2/2022,12:10:30,111,CUARTA_CLASE,2022-02-08,12,12,2,Tarde,Martes
AZUAY,CUENCA,#N/A,INTER PROVINCIAL,-3.280021667,-7909248167,"NABON,NABON,AZUAY",CUENCA,AZUAY,8/2/2022,12:11:23,101,CUARTA_CLASE,2022-02-08,12,12,2,Tarde,Martes
AZUAY,CUENCA,#N/A,INTER PROVINCIAL,-3.229936667,-7904460833,"NABON,NABON,AZUAY",CUENCA,AZUAY,8/2/2022,12:19:08,109,CUARTA_CLASE,2022-02-08,12,12,2,Tarde,Martes
AZUAY,CUENCA,#N/A,INTER PROVINCIAL,-3.328661667,-7917007,"LAS NIEVES,NABON,AZUAY",CUENCA,AZUAY,9/2/2022,11:44:26,105,CUARTA_CLASE,2022-02-09,11,11,3,Ma√±ana,Mi√©rcoles
AZUAY,CUENCA,#N/A,INTER PROVINCIAL,-3.343115,-7917987167,"LAS NIEVES,NABON,AZUAY",CUENCA,AZUAY,9/2/2022,11:45:40,103,CUARTA_CLASE,2022-02-09,11,11,3,Ma√±ana,Mi√©rcoles
AZUAY,CUENCA,#N/A,INTER PROVINCIAL,-3.356736667,-7918947333,"LAS NIEVES,NABON,AZUAY",CUENCA,AZUAY,9/2/2022,11:46:46,107,CUARTA_CLASE,2022-02-09,11,11,3,Ma√±ana,Mi√©rcoles
AZUAY,CUENCA,#N/A,INTER PROVINCIAL,-3.55091,-7917906333,"EL TABLON,SARAGURO,LOJA",CUENCA,AZUAY,9/2/2022,12:32:58,101,CUARTA_CLASE,2022-02-09,12,12,3,Tarde,Mi√©rcoles
AZUAY,CUENCA,#N/A,INTER PROVINCIAL,-1.779756667,-7874263,"SANTIAGO DE QUITO,COLTA,CHIMBORAZO",CUENCA,AZUAY,10/2/2022,02:50:09,103,CUARTA_CLASE,2022-02-10,2,2,4,Madrugada,Jueves
AZUAY,CUENCA,#N/A,INTER PROVINCIAL,-1.753538333,-7875810667,"VILLA LA UNION,COLTA,CHIMBORAZO",CUENCA,AZUAY,10/2/2022,02:52:32,105,CUARTA_CLASE,2022-02-10,2,2,4,Madrugada,Jueves
AZUAY,CUENCA,#N/A,INTER PROVINCIAL,-1.650185,-7873535833,"CALPI,RIOBAMBA,CHIMBORAZO",CUENCA,AZUAY,10/2/2022,03:04:29,103,CUARTA_CLASE,2022-02-10,3,3,4,Madrugada,Jueves
AZUAY,CUENCA,#N/A,INTER PROVINCIAL,-1.618753333,-78688945,"SAN ANDRES,GUANO,CHIMBORAZO",CUENCA,AZUAY,10/2/2022,03:17:01,103,CUARTA_CLASE,2022-02-10,3,3,4,Madrugada,Jueves
AZUAY,CUENCA,#N/A,INTER PROVINCIAL,-1.476383333,-7869554167,"YANAYACU,QUERO,TUNGURAHUA",CUENCA,AZUAY,10/2/2022,03:34:02,101,CUARTA_CLASE,2022-02-10,3,3,4,Madrugada,Jueves
AZUAY,CUENCA,#N/A,INTER PROVINCIAL,-1.467768333,-786901,"YANAYACU,QUERO,TUNGURAHUA",CUENCA,AZUAY,10/2/2022,03:34:43,101,CUARTA_CLASE,2022-02-10,3,3,4,Madrugada,Jueves
AZUAY,CUENCA,#N/A,INTER PROVINCIAL,-3.290328333,-79103615,"NABON,NABON,AZUAY",CUENCA,AZUAY,6/2/2022,16:49:11,103,CUARTA_CLASE,2022-02-06,16,16,7,Tarde,Domingo
AZUAY,CUENCA,#N/A,INTER PROVINCIAL,-3.030868333,-7904108833,"TARQUI,CUENCA,AZUAY",CUENCA,AZUAY,8/2/2022,00:13:23,103,CUARTA_CLASE,2022-02-08,0,0,2,Madrugada,Martes
AZUAY,CUENCA,#N/A,INTER PROVINCIAL,-3.057481667,-79036255,"CUMBE,CUENCA,AZUAY",CUENCA,AZUAY,8/2/2022,00:15:54,101,CUARTA_CLASE,2022-02-08,0,0,2,Madrugada,Martes
AZUAY,CUENCA,#N/A,INTER PROVINCIAL,-3.063195,-7903216333,"CUMBE,CUENCA,AZUAY",CUENCA,AZUAY,8/2/2022,00:16:23,105,CUARTA_CLASE,2022-02-08,0,0,2,Madrugada,Martes
AZUAY,CUENCA,#N/A,INTER PROVINCIAL,-3.344413333,-7918063667,"LAS NIEVES,NABON,AZUAY",CUENCA,AZUAY,8/2/2022,01:01:00,101,CUARTA_CLASE,2022-02-08,1,1,2,Madrugada,Martes
AZUAY,CUENCA,#N/A,INTER PROVINCIAL,-3.357115,-79189635,"LAS NIEVES,NABON,AZUAY",CUENCA,AZUAY,8/2/2022,01:02:02,103,CUARTA_CLASE,2022-02-08,1,1,2,Madrugada,Martes
AZUAY,CUENCA,#N/A,INTER PROVINCIAL,-3.895588333,-7878911167,"ZUMBI,CENTINELA DEL CONDOR,ZAMORA CHINCHIPE",CUENCA,AZUAY,5/2/2022,14:25:08,105,CUARTA_CLASE,2022-02-05,14,14,6,Tarde,S√°bado
AZUAY,CUENCA,#N/A,INTER PROVINCIAL,-3.071465,-7902314167,"CUMBE,CUENCA,AZUAY",CUENCA,AZUAY,6/2/2022,03:55:44,107,CUARTA_CLASE,2022-02-06,3,3,7,Madrugada,Domingo
AZUAY,CUENCA,#N/A,INTER PROVINCIAL,-3.357296667,-7918971,"LAS NIEVES,NABON,AZUAY",CUENCA,AZUAY,5/2/2022,08:50:24,103,CUARTA_CLASE,2022-02-05,8,8,6,Ma√±ana,S√°bado
AZUAY,CUENCA,#N/A,INTER PROVINCIAL,-3.357895,-7919039,"LAS NIEVES,NABON,AZUAY",CUENCA,AZUAY,7/2/2022,05:30:21,101,CUARTA_CLASE,2022-02-07,5,5,1,Madrugada,Lunes
AZUAY,CUENCA,#N/A,INTER PROVINCIAL,-3.352418333,-7918628333,"LAS NIEVES,NABON,AZUAY",CUENCA,AZUAY,7/2/2022,05:30:48,101,CUARTA_CLASE,2022-02-07,5,5,1,Madrugada,Lunes
AZUAY,CUENCA,#N/A,INTER PROVINCIAL,-3.28929,-79102535,"NABON,NABON,AZUAY",CUENCA,AZUAY,7/2/2022,05:46:04,109,CUARTA_CLASE,2022-02-07,5,5,1,Madrugada,Lunes
AZUAY,CUENCA,#N/A,INTER PROVINCIAL,-3.285106667,-79097365,"NABON,NABON,AZUAY",CUENCA,AZUAY,7/2/2022,05:46:30,103,CUARTA_CLASE,2022-02-07,5,5,1,Madrugada,Lunes
AZUAY,CUENCA,#N/A,INTER PROVINCIAL,-3.063508333,-7903171167,"CUMBE,CUENCA,AZUAY",CUENCA,AZUAY,11/2/2022,13:36:49,101,CUARTA_CLASE,2022-02-11,13,13,5,Tarde,Viernes
AZUAY,CUENCA,#N/A,INTER PROVINCIAL,-2.850016667,-7890002,"NULTI,CUENCA,AZUAY",CUENCA,AZUAY,11/2/2022,00:58:32,107,CUARTA_CLASE,2022-02-11,0,0,5,Madrugada,Viernes
AZUAY,CUENCA,#N/A,INTER PROVINCIAL,-2.86731,-7893534333,"CUENCA,CUENCA,AZUAY",CUENCA,AZUAY,11/2/2022,01:01:01,103,CUARTA_CLASE,2022-02-11,1,1,5,Madrugada,Viernes
AZUAY,CUENCA,#N/A,INTER PROVINCIAL,-2.876925,-7894160833,"CUENCA,CUENCA,AZUAY",CUENCA,AZUAY,11/2/2022,01:01:47,107,CUARTA_CLASE,2022-02-11,1,1,5,Madrugada,Viernes
AZUAY,CUENCA,#N/A,INTER PROVINCIAL,-2.920626667,-7901586,"CUENCA,CUENCA,AZUAY",CUENCA,AZUAY,11/2/2022,01:35:36,101,CUARTA_CLASE,2022-02-11,1,1,5,Madrugada,Viernes
AZUAY,CUENCA,#N/A,INTER PROVINCIAL,-2.924203333,-7903600667,"TURI,CUENCA,AZUAY",CUENCA,AZUAY,11/2/2022,01:37:17,111,CUARTA_CLASE,2022-02-11,1,1,5,Madrugada,Viernes
AZUAY,CUENCA,#N/A,INTER PROVINCIAL,-3.030141667,-7904082,"TARQUI,CUENCA,AZUAY",CUENCA,AZUAY,11/2/2022,01:49:22,103,CUARTA_CLASE,2022-02-11,1,1,5,Madrugada,Viernes
AZUAY,CUENCA,#N/A,INTER PROVINCIAL,-3.051005,-7903912667,"CUMBE,CUENCA,AZUAY",CUENCA,AZUAY,11/2/2022,01:51:28,103,CUARTA_CLASE,2022-02-11,1,1,5,Madrugada,Viernes
AZUAY,CUENCA,#N/A,INTER PROVINCIAL,-3.068396667,-7902618333,"CUMBE,CUENCA,AZUAY",CUENCA,AZUAY,11/2/2022,01:52:51,103,CUARTA_CLASE,2022-02-11,1,1,5,Madrugada,Viernes
AZUAY,CUENCA,#N/A,INTER PROVINCIAL,-3.084853333,-7901443333,"CUMBE,CUENCA,AZUAY",CUENCA,AZUAY,11/2/2022,01:54:19,103,CUARTA_CLASE,2022-02-11,1,1,5,Madrugada,Viernes
AZUAY,CUENCA,#N/A,INTER PROVINCIAL,-1.524953333,-7871985833,"SAN ANDRES,GUANO,CHIMBORAZO",CUENCA,AZUAY,10/2/2022,19:58:23,105,CUARTA_CLASE,2022-02-10,19,19,4,Noche,Jueves
AZUAY,CUENCA,#N/A,INTER PROVINCIAL,-1.541191667,-7873386167,"SAN ANDRES,GUANO,CHIMBORAZO",CUENCA,AZUAY,10/2/2022,20:00:03,101,CUARTA_CLASE,2022-02-10,20,20,4,Noche,Jueves
AZUAY,CUENCA,#N/A,INTER PROVINCIAL,-1.846606667,-7873312167,"COLUMBE,COLTA,CHIMBORAZO",CUENCA,AZUAY,10/2/2022,20:56:41,105,CUARTA_CLASE,2022-02-10,20,20,4,Noche,Jueves
AZUAY,CUENCA,#N/A,INTER PROVINCIAL,-3.057286667,-79036395,"CUMBE,CUENCA,AZUAY",CUENCA,AZUAY,11/2/2022,13:37:21,101,CUARTA_CLASE,2022-02-11,13,13,5,Tarde,Viernes
AZUAY,CUENCA,#N/A,INTER PROVINCIAL,-1.857106667,-7873070833,"COLUMBE,COLTA,CHIMBORAZO",CUENCA,AZUAY,10/2/2022,02:44:18,105,CUARTA_CLASE,2022-02-10,2,2,4,Madrugada,Jueves
AZUAY,CUENCA,#N/A,INTER PROVINCIAL,-1.832198333,-7873769333,"VILLA LA UNION,COLTA,CHIMBORAZO",CUENCA,AZUAY,10/2/2022,02:46:13,105,CUARTA_CLASE,2022-02-10,2,2,4,Madrugada,Jueves
AZUAY,CUENCA,#N/A,INTER PROVINCIAL,-1.79367,-7873776,"SANTIAGO DE QUITO,COLTA,CHIMBORAZO",CUENCA,AZUAY,10/2/2022,02:49:03,105,CUARTA_CLASE,2022-02-10,2,2,4,Madrugada,Jueves
AZUAY,CUENCA,#N/A,INTER PROVINCIAL,-0.71833,-7860250833,"SAN JUAN DE PASTOCALLE,LATACUNGA,COTOPAXI",CUENCA,AZUAY,10/2/2022,17:47:03,101,CUARTA_CLASE,2022-02-10,17,17,4,Tarde,Jueves
AZUAY,CUENCA,#N/A,INTER PROVINCIAL,-0.731476667,-7860952833,"SAN JUAN DE PASTOCALLE,LATACUNGA,COTOPAXI",CUENCA,AZUAY,10/2/2022,17:48:02,105,CUARTA_CLASE,2022-02-10,17,17,4,Tarde,Jueves
AZUAY,CUENCA,#N/A,INTER PROVINCIAL,-0.751586667,-7861560167,"TANICUCHI,LATACUNGA,COTOPAXI",CUENCA,AZUAY,10/2/2022,17:57:18,101,CUARTA_CLASE,2022-02-10,17,17,4,Tarde,Jueves
AZUAY,CUENCA,#N/A,INTER PROVINCIAL,-0.76745,-7861201167,"TANICUCHI,LATACUNGA,COTOPAXI",CUENCA,AZUAY,10/2/2022,17:58:21,107,CUARTA_CLASE,2022-02-10,17,17,4,Tarde,Jueves
AZUAY,CUENCA,#N/A,INTER PROVINCIAL,-0.784078333,-7861125833,"TANICUCHI,LATACUNGA,COTOPAXI",CUENCA,AZUAY,10/2/2022,17:59:26,109,CUARTA_CLASE,2022-02-10,17,17,4,Tarde,Jueves
AZUAY,CUENCA,#N/A,INTER PROVINCIAL,-0.818305,-7862441833,"JOSEGUANGO BAJO,LATACUNGA,COTOPAXI",CUENCA,AZUAY,10/2/2022,18:01:49,107,CUARTA_CLASE,2022-02-10,18,18,4,Noche,Jueves
AZUAY,CUENCA,#N/A,INTER PROVINCIAL,-0.896853333,-7865613833,"LATACUNGA,LATACUNGA,COTOPAXI",CUENCA,AZUAY,10/2/2022,18:09:50,101,CUARTA_CLASE,2022-02-10,18,18,4,Noche,Jueves
AZUAY,CUENCA,#N/A,INTER PROVINCIAL,-0.946406667,-7865586667,"PUJILI,PUJILI,COTOPAXI",CUENCA,AZUAY,10/2/2022,18:14:44,107,CUARTA_CLASE,2022-02-10,18,18,4,Noche,Jueves
AZUAY,CUENCA,#N/A,INTER PROVINCIAL,-0.953838333,-78651685,"LATACUNGA,LATACUNGA,COTOPAXI",CUENCA,AZUAY,10/2/2022,18:15:18,101,CUARTA_CLASE,2022-02-10,18,18,4,Noche,Jueves
AZUAY,CUENCA,#N/A,INTER PROVINCIAL,-1.006151667,-7860914167,"LATACUNGA,LATACUNGA,COTOPAXI",CUENCA,AZUAY,10/2/2022,18:21:51,105,CUARTA_CLASE,2022-02-10,18,18,4,Noche,Jueves
AZUAY,CUENCA,#N/A,INTER PROVINCIAL,-1.027038333,-78605725,"SAN MIGUEL,SALCEDO,COTOPAXI",CUENCA,AZUAY,10/2/2022,18:24:21,105,CUARTA_CLASE,2022-02-10,18,18,4,Noche,Jueves
AZUAY,CUENCA,#N/A,INTER PROVINCIAL,-1.206366667,-7858700667,"IZAMBA,AMBATO,TUNGURAHUA",CUENCA,AZUAY,10/2/2022,18:55:12,103,CUARTA_CLASE,2022-02-10,18,18,4,Noche,Jueves
AZUAY,CUENCA,#N/A,INTER PROVINCIAL,-1.95518,-7871085667,"GUAMOTE,GUAMOTE,CHIMBORAZO",CUENCA,AZUAY,10/2/2022,21:08:27,103,CUARTA_CLASE,2022-02-10,21,21,4,Noche,Jueves
AZUAY,CUENCA,#N/A,INTER PROVINCIAL,-2.00625,-7872819333,"GUAMOTE,GUAMOTE,CHIMBORAZO",CUENCA,AZUAY,10/2/2022,21:13:25,105,CUARTA_CLASE,2022-02-10,21,21,4,Noche,Jueves
AZUAY,CUENCA,#N/A,INTER PROVINCIAL,-2.031418333,-7873547833,"PALMIRA,GUAMOTE,CHIMBORAZO",CUENCA,AZUAY,10/2/2022,21:15:06,105,CUARTA_CLASE,2022-02-10,21,21,4,Noche,Jueves
AZUAY,CUENCA,#N/A,INTER PROVINCIAL,-2.043471667,-7873896167,"PALMIRA,GUAMOTE,CHIMBORAZO",CUENCA,AZUAY,10/2/2022,21:15:57,101,CUARTA_CLASE,2022-02-10,21,21,4,Noche,Jueves
AZUAY,CUENCA,#N/A,INTER PROVINCIAL,-2.050885,-7874266333,"PALMIRA,GUAMOTE,CHIMBORAZO",CUENCA,AZUAY,10/2/2022,21:16:30,103,CUARTA_CLASE,2022-02-10,21,21,4,Noche,Jueves
AZUAY,CUENCA,#N/A,INTER PROVINCIAL,-2.061916667,-7874298167,"PALMIRA,GUAMOTE,CHIMBORAZO",CUENCA,AZUAY,10/2/2022,21:17:18,101,CUARTA_CLASE,2022-02-10,21,21,4,Noche,Jueves
AZUAY,CUENCA,#N/A,INTER PROVINCIAL,-2.066726667,-7873993667,"PALMIRA,GUAMOTE,CHIMBORAZO",CUENCA,AZUAY,10/2/2022,21:17:41,103,CUARTA_CLASE,2022-02-10,21,21,4,Noche,Jueves
AZUAY,CUENCA,#N/A,INTER PROVINCIAL,-2.767818333,-7886182167,"AZOGUES,AZOGUES,CA—AR",CUENCA,AZUAY,11/2/2022,00:50:31,103,CUARTA_CLASE,2022-02-11,0,0,5,Madrugada,Viernes
AZUAY,CUENCA,#N/A,INTER PROVINCIAL,-2.778246667,-7886515833,"AZOGUES,AZOGUES,CA—AR",CUENCA,AZUAY,11/2/2022,00:51:21,111,CUARTA_CLASE,2022-02-11,0,0,5,Madrugada,Viernes
AZUAY,CUENCA,#N/A,INTER PROVINCIAL,-2.790598333,-7886939167,"JAVIER LOYOLA,AZOGUES,CA—AR",CUENCA,AZUAY,11/2/2022,00:52:36,101,CUARTA_CLASE,2022-02-11,0,0,5,Madrugada,Viernes
AZUAY,CUENCA,#N/A,INTER PROVINCIAL,-2.80109,-78880615,"JAVIER LOYOLA,AZOGUES,CA—AR",CUENCA,AZUAY,11/2/2022,00:53:39,109,CUARTA_CLASE,2022-02-11,0,0,5,Madrugada,Viernes
AZUAY,CUENCA,#N/A,INTER PROVINCIAL,-2.808743333,-78882365,"JAVIER LOYOLA,AZOGUES,CA—AR",CUENCA,AZUAY,11/2/2022,00:54:09,103,CUARTA_CLASE,2022-02-11,0,0,5,Madrugada,Viernes
AZUAY,CUENCA,#N/A,INTER PROVINCIAL,-2.827065,-7888229833,"JAVIER LOYOLA,AZOGUES,CA—AR",CUENCA,AZUAY,11/2/2022,00:55:53,103,CUARTA_CLASE,2022-02-11,0,0,5,Madrugada,Viernes
AZUAY,CUENCA,#N/A,INTER PROVINCIAL,-2.840471667,-7887733667,"LLACAO,CUENCA,AZUAY",CUENCA,AZUAY,11/2/2022,00:56:49,112,CUARTA_CLASE,2022-02-11,0,0,5,Madrugada,Viernes
AZUAY,CUENCA,#N/A,INTER PROVINCIAL,-2.845656667,-7888797667,"NULTI,CUENCA,AZUAY",CUENCA,AZUAY,11/2/2022,00:57:44,105,CUARTA_CLASE,2022-02-11,0,0,5,Madrugada,Viernes
AZUAY,CUENCA,#N/A,INTER PROVINCIAL,-0.57046,-7859351167,"ALOASI,MEJIA,PICHINCHA",CUENCA,AZUAY,10/2/2022,17:34:14,103,CUARTA_CLASE,2022-02-10,17,17,4,Tarde,Jueves
AZUAY,CUENCA,#N/A,INTER PROVINCIAL,-0.620928333,-7859526167,"SAN JUAN DE PASTOCALLE,LATACUNGA,COTOPAXI",CUENCA,AZUAY,10/2/2022,17:39:17,107,CUARTA_CLASE,2022-02-10,17,17,4,Tarde,Jueves
AZUAY,CUENCA,#N/A,INTER PROVINCIAL,-0.63881,-7859491667,"SAN JUAN DE PASTOCALLE,LATACUNGA,COTOPAXI",CUENCA,AZUAY,10/2/2022,17:40:29,103,CUARTA_CLASE,2022-02-10,17,17,4,Tarde,Jueves
AZUAY,CUENCA,#N/A,INTER PROVINCIAL,-0.652143333,-7859249333,"SAN JUAN DE PASTOCALLE,LATACUNGA,COTOPAXI",CUENCA,AZUAY,10/2/2022,17:41:22,107,CUARTA_CLASE,2022-02-10,17,17,4,Tarde,Jueves
AZUAY,CUENCA,#N/A,INTER PROVINCIAL,-0.692,-78587115,"SAN JUAN DE PASTOCALLE,LATACUNGA,COTOPAXI",CUENCA,AZUAY,10/2/2022,17:45:00,105,CUARTA_CLASE,2022-02-10,17,17,4,Tarde,Jueves
AZUAY,CUENCA,#N/A,INTER PROVINCIAL,-1.251781667,-7859654167,"AMBATO,AMBATO,TUNGURAHUA",CUENCA,AZUAY,10/2/2022,04:08:36,103,CUARTA_CLASE,2022-02-10,4,4,4,Madrugada,Jueves
AZUAY,CUENCA,#N/A,INTER PROVINCIAL,-1.203665,-7858820167,"IZAMBA,AMBATO,TUNGURAHUA",CUENCA,AZUAY,10/2/2022,04:14:54,103,CUARTA_CLASE,2022-02-10,4,4,4,Madrugada,Jueves
AZUAY,CUENCA,#N/A,INTER PROVINCIAL,-1.164395,-7858567833,"UNAMUNCHO,AMBATO,TUNGURAHUA",CUENCA,AZUAY,10/2/2022,04:19:10,111,CUARTA_CLASE,2022-02-10,4,4,4,Madrugada,Jueves
AZUAY,CUENCA,#N/A,INTER PROVINCIAL,-1.154061667,-7858556667,"UNAMUNCHO,AMBATO,TUNGURAHUA",CUENCA,AZUAY,10/2/2022,04:19:50,101,CUARTA_CLASE,2022-02-10,4,4,4,Madrugada,Jueves
AZUAY,CUENCA,#N/A,INTER PROVINCIAL,-1.138271667,-7858768667,"CUNCHIBAMBA,AMBATO,TUNGURAHUA",CUENCA,AZUAY,10/2/2022,04:20:55,101,CUARTA_CLASE,2022-02-10,4,4,4,Madrugada,Jueves
AZUAY,CUENCA,#N/A,INTER PROVINCIAL,-1.131788333,-78588575,"CUNCHIBAMBA,AMBATO,TUNGURAHUA",CUENCA,AZUAY,10/2/2022,04:21:21,101,CUARTA_CLASE,2022-02-10,4,4,4,Madrugada,Jueves
AZUAY,CUENCA,#N/A,INTER PROVINCIAL,-1.082088333,-7859484,"PANSALEO,SALCEDO,COTOPAXI",CUENCA,AZUAY,10/2/2022,04:25:28,105,CUARTA_CLASE,2022-02-10,4,4,4,Madrugada,Jueves
AZUAY,CUENCA,#N/A,INTER PROVINCIAL,-1.052915,-7860272667,"SAN MIGUEL,SALCEDO,COTOPAXI",CUENCA,AZUAY,10/2/2022,04:28:39,101,CUARTA_CLASE,2022-02-10,4,4,4,Madrugada,Jueves
AZUAY,CUENCA,#N/A,INTER PROVINCIAL,-1.03409,-78602065,"SAN MIGUEL,SALCEDO,COTOPAXI",CUENCA,AZUAY,10/2/2022,04:30:51,103,CUARTA_CLASE,2022-02-10,4,4,4,Madrugada,Jueves
AZUAY,CUENCA,#N/A,INTER PROVINCIAL,-0.99661,-7861229333,"LATACUNGA,LATACUNGA,COTOPAXI",CUENCA,AZUAY,10/2/2022,04:33:30,105,CUARTA_CLASE,2022-02-10,4,4,4,Madrugada,Jueves
AZUAY,CUENCA,#N/A,INTER PROVINCIAL,-0.960556667,-7864765167,"LATACUNGA,LATACUNGA,COTOPAXI",CUENCA,AZUAY,10/2/2022,04:37:25,103,CUARTA_CLASE,2022-02-10,4,4,4,Madrugada,Jueves
AZUAY,CUENCA,#N/A,INTER PROVINCIAL,-0.92418,-78659875,"LATACUNGA,LATACUNGA,COTOPAXI",CUENCA,AZUAY,10/2/2022,04:41:31,111,CUARTA_CLASE,2022-02-10,4,4,4,Madrugada,Jueves
AZUAY,CUENCA,#N/A,INTER PROVINCIAL,-0.849383333,-7861949333,"GUAITACAMA,LATACUNGA,COTOPAXI",CUENCA,AZUAY,10/2/2022,04:47:51,103,CUARTA_CLASE,2022-02-10,4,4,4,Madrugada,Jueves
AZUAY,CUENCA,#N/A,INTER PROVINCIAL,-0.921505,-78659995,"LATACUNGA,LATACUNGA,COTOPAXI",CUENCA,AZUAY,8/2/2022,22:11:26,101,CUARTA_CLASE,2022-02-08,22,22,2,Noche,Martes
AZUAY,CUENCA,#N/A,INTER PROVINCIAL,-1.861618333,-7872888333,"COLUMBE,COLTA,CHIMBORAZO",CUENCA,AZUAY,6/2/2022,20:11:37,107,CUARTA_CLASE,2022-02-06,20,20,7,Noche,Domingo
AZUAY,CUENCA,#N/A,INTER PROVINCIAL,-1.890643333,-78714825,"COLUMBE,COLTA,CHIMBORAZO",CUENCA,AZUAY,6/2/2022,20:14:33,105,CUARTA_CLASE,2022-02-06,20,20,7,Noche,Domingo
AZUAY,CUENCA,#N/A,INTER PROVINCIAL,-2.033525,-7873594167,"PALMIRA,GUAMOTE,CHIMBORAZO",CUENCA,AZUAY,6/2/2022,20:32:16,101,CUARTA_CLASE,2022-02-06,20,20,7,Noche,Domingo
AZUAY,CUENCA,#N/A,INTER PROVINCIAL,-0.834943333,-78618955,"GUAITACAMA,LATACUNGA,COTOPAXI",CUENCA,AZUAY,7/2/2022,20:20:52,107,CUARTA_CLASE,2022-02-07,20,20,1,Noche,Lunes
AZUAY,CUENCA,#N/A,INTER PROVINCIAL,-2.827175,-7888220333,"JAVIER LOYOLA,AZOGUES,CA—AR",CUENCA,AZUAY,7/2/2022,13:07:33,101,CUARTA_CLASE,2022-02-07,13,13,1,Tarde,Lunes
AZUAY,CUENCA,#N/A,INTER PROVINCIAL,-2.254866667,-79615365,"GRAL. PEDRO J. MONTERO,SAN JACINTO DE YAGUACHI,GUAYAS",CUENCA,AZUAY,1/2/2022,05:14:06,101,CUARTA_CLASE,2022-02-01,5,5,2,Madrugada,Martes
AZUAY,CUENCA,#N/A,INTER PROVINCIAL,-2.867093333,-7893520333,"CUENCA,CUENCA,AZUAY",CUENCA,AZUAY,7/2/2022,00:06:42,101,CUARTA_CLASE,2022-02-07,0,0,1,Madrugada,Lunes
AZUAY,CUENCA,#N/A,INTER PROVINCIAL,-1.623295,-78683385,"SAN ANDRES,GUANO,CHIMBORAZO",CUENCA,AZUAY,4/2/2022,01:34:10,114,CUARTA_CLASE,2022-02-04,1,1,5,Madrugada,Viernes
AZUAY,CUENCA,#N/A,INTER PROVINCIAL,-2.883201667,-7894688667,"CUENCA,CUENCA,AZUAY",CUENCA,AZUAY,2/2/2022,19:36:15,101,CUARTA_CLASE,2022-02-02,19,19,3,Noche,Mi√©rcoles
AZUAY,CUENCA,#N/A,INTER PROVINCIAL,-2.872283333,-78938365,"CUENCA,CUENCA,AZUAY",CUENCA,AZUAY,2/2/2022,19:37:12,101,CUARTA_CLASE,2022-02-02,19,19,3,Noche,Mi√©rcoles
AZUAY,CUENCA,#N/A,INTER PROVINCIAL,-2.853853333,-78913035,"NULTI,CUENCA,AZUAY",CUENCA,AZUAY,2/2/2022,19:39:34,101,CUARTA_CLASE,2022-02-02,19,19,3,Noche,Mi√©rcoles
AZUAY,CUENCA,#N/A,INTER PROVINCIAL,-2.840561667,-7887735667,"LLACAO,CUENCA,AZUAY",CUENCA,AZUAY,7/2/2022,00:01:41,101,CUARTA_CLASE,2022-02-07,0,0,1,Madrugada,Lunes
AZUAY,GIRON,#N/A,INTRA PROVINCIAL,-2.908576667,-78980685,"CUENCA,CUENCA,AZUAY",GIRON,AZUAY,4/2/2022,09:35:20,103,CUARTA_CLASE,2022-02-04,9,9,5,Ma√±ana,Viernes
AZUAY,GIRON,#N/A,INTRA PROVINCIAL,-3.072591667,-7906408833,"VICTORIA DEL PORTETE,CUENCA,AZUAY",GIRON,AZUAY,3/2/2022,18:02:44,103,CUARTA_CLASE,2022-02-03,18,18,4,Noche,Jueves
AZUAY,GIRON,#N/A,INTRA PROVINCIAL,-3.066656667,-7905601167,"VICTORIA DEL PORTETE,CUENCA,AZUAY",GIRON,AZUAY,3/2/2022,18:02:00,103,CUARTA_CLASE,2022-02-03,18,18,4,Noche,Jueves
AZUAY,GIRON,#N/A,INTRA PROVINCIAL,-3.052356667,-7904797167,"VICTORIA DEL PORTETE,CUENCA,AZUAY",GIRON,AZUAY,4/2/2022,05:29:45,107,CUARTA_CLASE,2022-02-04,5,5,5,Madrugada,Viernes
AZUAY,GUALACEO,#N/A,INTRA PROVINCIAL,-2.846486667,-7888917833,"NULTI,CUENCA,AZUAY",GUALACEO,AZUAY,6/2/2022,14:40:17,105,CUARTA_CLASE,2022-02-06,14,14,7,Tarde,Domingo
AZUAY,GUALACEO,#N/A,INTRA PROVINCIAL,-2.85293,-7890828,"NULTI,CUENCA,AZUAY",GUALACEO,AZUAY,3/2/2022,14:05:54,101,CUARTA_CLASE,2022-02-03,14,14,4,Tarde,Jueves
AZUAY,GUALACEO,#N/A,INTRA PROVINCIAL,-2.848515,-78895345,"NULTI,CUENCA,AZUAY",GUALACEO,AZUAY,3/2/2022,14:07:31,105,CUARTA_CLASE,2022-02-03,14,14,4,Tarde,Jueves
AZUAY,GUALACEO,#N/A,INTRA PROVINCIAL,-2.8531,-7890977167,"NULTI,CUENCA,AZUAY",GUALACEO,AZUAY,8/2/2022,06:26:36,103,CUARTA_CLASE,2022-02-08,6,6,2,Ma√±ana,Martes
AZUAY,GUALACEO,#N/A,INTRA PROVINCIAL,-2.853531667,-7891129667,"NULTI,CUENCA,AZUAY",GUALACEO,AZUAY,6/2/2022,14:38:05,107,CUARTA_CLASE,2022-02-06,14,14,7,Tarde,Domingo
AZUAY,GUALACEO,#N/A,INTRA PROVINCIAL,-2.867861667,-7893559,"CUENCA,CUENCA,AZUAY",GUALACEO,AZUAY,5/2/2022,07:01:14,107,CUARTA_CLASE,2022-02-05,7,7,6,Ma√±ana,S√°bado
AZUAY,GUALACEO,#N/A,INTER PROVINCIAL,-2.887701667,-7895184333,"CUENCA,CUENCA,AZUAY",GUALACEO,AZUAY,8/2/2022,09:20:45,103,CUARTA_CLASE,2022-02-08,9,9,2,Ma√±ana,Martes
AZUAY,GUALACEO,#N/A,INTER PROVINCIAL,-2.846841667,-7889024167,"NULTI,CUENCA,AZUAY",GUALACEO,AZUAY,11/2/2022,09:12:25,111,CUARTA_CLASE,2022-02-11,9,9,5,Ma√±ana,Viernes
AZUAY,GUALACEO,#N/A,INTER PROVINCIAL,-2.848068333,-7889392833,"NULTI,CUENCA,AZUAY",GUALACEO,AZUAY,3/2/2022,16:34:45,103,CUARTA_CLASE,2022-02-03,16,16,4,Tarde,Jueves
AZUAY,GUALACEO,#N/A,INTER PROVINCIAL,-2.85368,-7891208,"NULTI,CUENCA,AZUAY",GUALACEO,AZUAY,9/2/2022,06:12:07,107,CUARTA_CLASE,2022-02-09,6,6,3,Ma√±ana,Mi√©rcoles
AZUAY,GUALACEO,#N/A,INTER PROVINCIAL,-2.855093333,-7891926833,"CUENCA,CUENCA,AZUAY",GUALACEO,AZUAY,3/2/2022,16:33:06,103,CUARTA_CLASE,2022-02-03,16,16,4,Tarde,Jueves
AZUAY,GUALACEO,#N/A,INTER PROVINCIAL,-2.891468333,-7899073167,"CUENCA,CUENCA,AZUAY",GUALACEO,AZUAY,2/2/2022,08:44:42,149,PRIMERA_CLASE,2022-02-02,8,8,3,Ma√±ana,Mi√©rcoles
AZUAY,GUALACEO,#N/A,INTER PROVINCIAL,-2.86319,-78929695,"CUENCA,CUENCA,AZUAY",GUALACEO,AZUAY,6/2/2022,13:35:27,101,CUARTA_CLASE,2022-02-06,13,13,7,Tarde,Domingo
AZUAY,GUALACEO,#N/A,INTER PROVINCIAL,-2.853401667,-7891078,"NULTI,CUENCA,AZUAY",GUALACEO,AZUAY,3/2/2022,16:33:43,112,CUARTA_CLASE,2022-02-03,16,16,4,Tarde,Jueves
AZUAY,GUALACEO,#N/A,INTER PROVINCIAL,-2.846923333,-78890115,"NULTI,CUENCA,AZUAY",GUALACEO,AZUAY,9/2/2022,06:13:57,109,CUARTA_CLASE,2022-02-09,6,6,3,Ma√±ana,Mi√©rcoles
AZUAY,NABON,#N/A,INTRA PROVINCIAL,-3.195403333,-7902662667,"GIRON,GIRON,AZUAY",NABON,AZUAY,11/2/2022,08:22:10,101,CUARTA_CLASE,2022-02-11,8,8,5,Ma√±ana,Viernes
AZUAY,NABON,#N/A,INTRA PROVINCIAL,-2.920916667,-7901690833,"CUENCA,CUENCA,AZUAY",NABON,AZUAY,2/2/2022,06:21:52,103,CUARTA_CLASE,2022-02-02,6,6,3,Ma√±ana,Mi√©rcoles
AZUAY,NABON,#N/A,INTRA PROVINCIAL,-3.195436667,-7902665167,"GIRON,GIRON,AZUAY",NABON,AZUAY,8/2/2022,07:18:27,103,CUARTA_CLASE,2022-02-08,7,7,2,Ma√±ana,Martes
AZUAY,NABON,#N/A,INTRA PROVINCIAL,-3.05772,-7903621167,"CUMBE,CUENCA,AZUAY",NABON,AZUAY,11/2/2022,05:40:39,101,CUARTA_CLASE,2022-02-11,5,5,5,Madrugada,Viernes
AZUAY,SANTA ISABEL,#N/A,INTRA PROVINCIAL,-3.186646667,-79171165,"GIRON,GIRON,AZUAY",SANTA ISABEL,AZUAY,1/2/2022,11:09:57,101,CUARTA_CLASE,2022-02-01,11,11,2,Ma√±ana,Martes
AZUAY,SANTA ISABEL,#N/A,INTRA PROVINCIAL,-3.072315,-79063485,"VICTORIA DEL PORTETE,CUENCA,AZUAY",SANTA ISABEL,AZUAY,3/2/2022,08:09:10,105,CUARTA_CLASE,2022-02-03,8,8,4,Ma√±ana,Jueves
AZUAY,SANTA ISABEL,#N/A,INTRA PROVINCIAL,-3.073576667,-7906588667,"VICTORIA DEL PORTETE,CUENCA,AZUAY",SANTA ISABEL,AZUAY,3/2/2022,14:24:40,101,CUARTA_CLASE,2022-02-03,14,14,4,Tarde,Jueves
AZUAY,SIGSIG,#N/A,INTER PROVINCIAL,-2.863423333,-7893004833,"CUENCA,CUENCA,AZUAY",SIGSIG,AZUAY,10/2/2022,16:11:40,101,CUARTA_CLASE,2022-02-10,16,16,4,Tarde,Jueves
AZUAY,SIGSIG,#N/A,INTER PROVINCIAL,-2.867201667,-7893517333,"CUENCA,CUENCA,AZUAY",SIGSIG,AZUAY,9/2/2022,09:56:20,103,CUARTA_CLASE,2022-02-09,9,9,3,Ma√±ana,Mi√©rcoles
AZUAY,SIGSIG,#N/A,INTER PROVINCIAL,-2.845538333,-7888747,"NULTI,CUENCA,AZUAY",SIGSIG,AZUAY,8/2/2022,08:58:17,111,CUARTA_CLASE,2022-02-08,8,8,2,Ma√±ana,Martes
AZUAY,SIGSIG,#N/A,INTER PROVINCIAL,-2.846396667,-7888927,"NULTI,CUENCA,AZUAY",SIGSIG,AZUAY,2/2/2022,18:28:52,103,CUARTA_CLASE,2022-02-02,18,18,3,Noche,Mi√©rcoles
AZUAY,SIGSIG,#N/A,INTER PROVINCIAL,-2.849986667,-7889974333,"NULTI,CUENCA,AZUAY",SIGSIG,AZUAY,10/2/2022,16:09:17,101,CUARTA_CLASE,2022-02-10,16,16,4,Tarde,Jueves
AZUAY,SIGSIG,#N/A,INTER PROVINCIAL,-2.847068333,-7889113667,"NULTI,CUENCA,AZUAY",SIGSIG,AZUAY,9/2/2022,10:00:50,101,CUARTA_CLASE,2022-02-09,10,10,3,Ma√±ana,Mi√©rcoles
AZUAY,SIGSIG,#N/A,INTER PROVINCIAL,-2.889868333,-7895498,"CUENCA,CUENCA,AZUAY",SIGSIG,AZUAY,3/2/2022,19:36:46,105,CUARTA_CLASE,2022-02-03,19,19,4,Noche,Jueves
AZUAY,SIGSIG,#N/A,INTER PROVINCIAL,-2.85343,-7891116,"NULTI,CUENCA,AZUAY",SIGSIG,AZUAY,11/2/2022,12:57:01,101,CUARTA_CLASE,2022-02-11,12,12,5,Tarde,Viernes
AZUAY,SIGSIG,#N/A,INTER PROVINCIAL,-2.88651,-7894968667,"CUENCA,CUENCA,AZUAY",SIGSIG,AZUAY,9/2/2022,17:39:22,103,CUARTA_CLASE,2022-02-09,17,17,3,Tarde,Mi√©rcoles
AZUAY,SIGSIG,#N/A,INTER PROVINCIAL,-2.885368333,-78948045,"CUENCA,CUENCA,AZUAY",SIGSIG,AZUAY,1/2/2022,12:19:08,103,CUARTA_CLASE,2022-02-01,12,12,2,Tarde,Martes
AZUAY,SIGSIG,#N/A,INTER PROVINCIAL,-2.8893,-7895433833,"CUENCA,CUENCA,AZUAY",SIGSIG,AZUAY,1/2/2022,09:11:56,103,CUARTA_CLASE,2022-02-01,9,9,2,Ma√±ana,Martes
AZUAY,SIGSIG,#N/A,INTER PROVINCIAL,-3.420156667,-7857202333,"GUALAQUIZA,GUALAQUIZA,MORONA SANTIAGO",SIGSIG,AZUAY,3/2/2022,14:45:00,107,CUARTA_CLASE,2022-02-03,14,14,4,Tarde,Jueves
AZUAY,SIGSIG,#N/A,INTER PROVINCIAL,-2.846923333,-78890445,"NULTI,CUENCA,AZUAY",SIGSIG,AZUAY,3/2/2022,12:28:47,105,CUARTA_CLASE,2022-02-03,12,12,4,Tarde,Jueves
AZUAY,SIGSIG,#N/A,INTER PROVINCIAL,-2.852623333,-7890696,"NULTI,CUENCA,AZUAY",SIGSIG,AZUAY,3/2/2022,12:27:36,101,CUARTA_CLASE,2022-02-03,12,12,4,Tarde,Jueves
AZUAY,SIGSIG,#N/A,INTER PROVINCIAL,-3.420915,-7857173333,"GUALAQUIZA,GUALAQUIZA,MORONA SANTIAGO",SIGSIG,AZUAY,3/2/2022,17:10:20,103,CUARTA_CLASE,2022-02-03,17,17,4,Tarde,Jueves
AZUAY,SIGSIG,#N/A,INTER PROVINCIAL,-2.886553333,-7894959667,"CUENCA,CUENCA,AZUAY",SIGSIG,AZUAY,6/2/2022,14:55:21,103,CUARTA_CLASE,2022-02-06,14,14,7,Tarde,Domingo
AZUAY,SIGSIG,#N/A,INTER PROVINCIAL,-2.886163333,-7894902333,"CUENCA,CUENCA,AZUAY",SIGSIG,AZUAY,7/2/2022,16:03:01,109,CUARTA_CLASE,2022-02-07,16,16,1,Tarde,Lunes
AZUAY,SIGSIG,#N/A,INTER PROVINCIAL,-2.866276667,-7893441,"CUENCA,CUENCA,AZUAY",SIGSIG,AZUAY,7/2/2022,16:01:14,101,CUARTA_CLASE,2022-02-07,16,16,1,Tarde,Lunes
AZUAY,SIGSIG,#N/A,INTER PROVINCIAL,-2.86335,-7892998,"CUENCA,CUENCA,AZUAY",SIGSIG,AZUAY,7/2/2022,16:00:52,103,CUARTA_CLASE,2022-02-07,16,16,1,Tarde,Lunes
AZUAY,SIGSIG,#N/A,INTER PROVINCIAL,-2.85119,-7890267667,"NULTI,CUENCA,AZUAY",SIGSIG,AZUAY,10/2/2022,12:36:19,101,CUARTA_CLASE,2022-02-10,12,12,4,Tarde,Jueves
AZUAY,SIGSIG,#N/A,INTER PROVINCIAL,-2.881026667,-7894527167,"CUENCA,CUENCA,AZUAY",SIGSIG,AZUAY,10/2/2022,12:32:09,103,CUARTA_CLASE,2022-02-10,12,12,4,Tarde,Jueves
AZUAY,SIGSIG,#N/A,INTER PROVINCIAL,-2.866246667,-7893423167,"CUENCA,CUENCA,AZUAY",SIGSIG,AZUAY,1/2/2022,12:20:41,101,CUARTA_CLASE,2022-02-01,12,12,2,Tarde,Martes
AZUAY,SIGSIG,#N/A,INTER PROVINCIAL,-2.854971667,-7891877667,"CUENCA,CUENCA,AZUAY",SIGSIG,AZUAY,11/2/2022,04:57:40,101,CUARTA_CLASE,2022-02-11,4,4,5,Madrugada,Viernes
BOLIVAR,CALUMA,#N/A,INTER PROVINCIAL,-1.844175,-7934037667,"MONTALVO,MONTALVO,LOS RIOS",CALUMA,BOLIVAR,8/2/2022,14:02:00,107,CUARTA_CLASE,2022-02-08,14,14,2,Tarde,Martes
BOLIVAR,CALUMA,#N/A,INTER PROVINCIAL,-1.839955,-7933523667,"MONTALVO,MONTALVO,LOS RIOS",CALUMA,BOLIVAR,8/2/2022,14:02:27,103,CUARTA_CLASE,2022-02-08,14,14,2,Tarde,Martes
BOLIVAR,CALUMA,#N/A,INTER PROVINCIAL,-1.809628333,-7930636167,"MONTALVO,MONTALVO,LOS RIOS",CALUMA,BOLIVAR,8/2/2022,14:05:26,109,CUARTA_CLASE,2022-02-08,14,14,2,Tarde,Martes
BOLIVAR,CALUMA,#N/A,INTER PROVINCIAL,-2.42229,-79359925,"LA TRONCAL,LA TRONCAL,CA—AR",CALUMA,BOLIVAR,7/2/2022,23:23:48,101,CUARTA_CLASE,2022-02-07,23,23,1,Noche,Lunes
BOLIVAR,CALUMA,#N/A,INTER PROVINCIAL,-1.371276667,-7881437,"PILAGUIN,AMBATO,TUNGURAHUA",CALUMA,BOLIVAR,10/2/2022,16:35:43,112,CUARTA_CLASE,2022-02-10,16,16,4,Tarde,Jueves
BOLIVAR,CALUMA,#N/A,INTER PROVINCIAL,-2.107216667,-7972059833,"SAN JACINTO DE YAGUACHI,SAN JACINTO DE YAGUACHI,GUAYAS",CALUMA,BOLIVAR,8/2/2022,12:35:59,101,CUARTA_CLASE,2022-02-08,12,12,2,Tarde,Martes
BOLIVAR,CALUMA,#N/A,INTER PROVINCIAL,-1.855191667,-79354415,"MONTALVO,MONTALVO,LOS RIOS",CALUMA,BOLIVAR,8/2/2022,14:00:48,107,CUARTA_CLASE,2022-02-08,14,14,2,Tarde,Martes
BOLIVAR,CALUMA,#N/A,INTER PROVINCIAL,-1.851715,-7941657,"MONTALVO,MONTALVO,LOS RIOS",CALUMA,BOLIVAR,8/2/2022,13:56:30,103,CUARTA_CLASE,2022-02-08,13,13,2,Tarde,Martes
BOLIVAR,CALUMA,#N/A,INTER PROVINCIAL,-1.406628333,-7885943333,"PILAGUIN,AMBATO,TUNGURAHUA",CALUMA,BOLIVAR,10/2/2022,16:44:46,101,CUARTA_CLASE,2022-02-10,16,16,4,Tarde,Jueves
BOLIVAR,CALUMA,#N/A,INTER PROVINCIAL,-2.079651667,-7965543667,"SAN JACINTO DE YAGUACHI,SAN JACINTO DE YAGUACHI,GUAYAS",CALUMA,BOLIVAR,8/2/2022,12:43:45,103,CUARTA_CLASE,2022-02-08,12,12,2,Tarde,Martes
BOLIVAR,CALUMA,#N/A,INTER PROVINCIAL,-1.43086,-7889760833,"PILAGUIN,AMBATO,TUNGURAHUA",CALUMA,BOLIVAR,9/2/2022,08:09:58,103,CUARTA_CLASE,2022-02-09,8,8,3,Ma√±ana,Mi√©rcoles
BOLIVAR,GUARANDA,#N/A,INTER PROVINCIAL,-1.44629,-79445605,"VENTANAS,VENTANAS,LOS RIOS",GUARANDA,BOLIVAR,11/2/2022,09:40:08,103,CUARTA_CLASE,2022-02-11,9,9,5,Ma√±ana,Viernes
BOLIVAR,GUARANDA,#N/A,INTER PROVINCIAL,-1.44604,-7941281167,"VENTANAS,VENTANAS,LOS RIOS",GUARANDA,BOLIVAR,11/2/2022,17:36:10,101,CUARTA_CLASE,2022-02-11,17,17,5,Tarde,Viernes
BOLIVAR,GUARANDA,#N/A,INTER PROVINCIAL,-1.463443333,-79356345,"VENTANAS,VENTANAS,LOS RIOS",GUARANDA,BOLIVAR,9/2/2022,14:01:17,107,CUARTA_CLASE,2022-02-09,14,14,3,Tarde,Mi√©rcoles
BOLIVAR,GUARANDA,#N/A,INTER PROVINCIAL,-1.446048333,-7945156667,"VENTANAS,VENTANAS,LOS RIOS",GUARANDA,BOLIVAR,9/2/2022,13:41:21,101,CUARTA_CLASE,2022-02-09,13,13,3,Tarde,Mi√©rcoles
BOLIVAR,GUARANDA,#N/A,INTER PROVINCIAL,-1.452758333,-7933702167,"ECHEANDIA,ECHEANDIA,BOLIVAR",GUARANDA,BOLIVAR,9/2/2022,13:59:28,105,CUARTA_CLASE,2022-02-09,13,13,3,Tarde,Mi√©rcoles
BOLIVAR,GUARANDA,#N/A,INTER PROVINCIAL,-1.448618333,-79311405,"ECHEANDIA,ECHEANDIA,BOLIVAR",GUARANDA,BOLIVAR,5/2/2022,11:36:39,103,CUARTA_CLASE,2022-02-05,11,11,6,Ma√±ana,S√°bado
BOLIVAR,GUARANDA,#N/A,INTER PROVINCIAL,-1.451805,-7933507833,"ECHEANDIA,ECHEANDIA,BOLIVAR",GUARANDA,BOLIVAR,5/2/2022,11:38:42,101,CUARTA_CLASE,2022-02-05,11,11,6,Ma√±ana,S√°bado
BOLIVAR,GUARANDA,#N/A,INTER PROVINCIAL,-1.44331,-7942114333,"VENTANAS,VENTANAS,LOS RIOS",GUARANDA,BOLIVAR,3/2/2022,10:51:47,107,CUARTA_CLASE,2022-02-03,10,10,4,Ma√±ana,Jueves
BOLIVAR,GUARANDA,#N/A,INTER PROVINCIAL,-1.443206667,-7942249667,"VENTANAS,VENTANAS,LOS RIOS",GUARANDA,BOLIVAR,3/2/2022,14:39:07,103,CUARTA_CLASE,2022-02-03,14,14,4,Tarde,Jueves
BOLIVAR,GUARANDA,#N/A,INTER PROVINCIAL,-1.446303333,-7944438,"VENTANAS,VENTANAS,LOS RIOS",GUARANDA,BOLIVAR,3/2/2022,14:41:02,101,CUARTA_CLASE,2022-02-03,14,14,4,Tarde,Jueves
BOLIVAR,GUARANDA,#N/A,INTER PROVINCIAL,-1.44623,-7944661833,"VENTANAS,VENTANAS,LOS RIOS",GUARANDA,BOLIVAR,3/2/2022,15:17:50,101,CUARTA_CLASE,2022-02-03,15,15,4,Tarde,Jueves
BOLIVAR,GUARANDA,#N/A,INTER PROVINCIAL,-1.464231667,-7935728667,"VENTANAS,VENTANAS,LOS RIOS",GUARANDA,BOLIVAR,4/2/2022,08:53:20,107,CUARTA_CLASE,2022-02-04,8,8,5,Ma√±ana,Viernes
BOLIVAR,GUARANDA,#N/A,INTER PROVINCIAL,-1.489221667,-79383075,"VENTANAS,VENTANAS,LOS RIOS",GUARANDA,BOLIVAR,4/2/2022,08:56:57,107,CUARTA_CLASE,2022-02-04,8,8,5,Ma√±ana,Viernes
BOLIVAR,GUARANDA,#N/A,INTER PROVINCIAL,-1.455023333,-7939713167,"VENTANAS,VENTANAS,LOS RIOS",GUARANDA,BOLIVAR,4/2/2022,09:02:05,103,CUARTA_CLASE,2022-02-04,9,9,5,Ma√±ana,Viernes
BOLIVAR,GUARANDA,#N/A,INTER PROVINCIAL,-1.446065,-7941278833,"VENTANAS,VENTANAS,LOS RIOS",GUARANDA,BOLIVAR,4/2/2022,09:04:16,103,CUARTA_CLASE,2022-02-04,9,9,5,Ma√±ana,Viernes
BOLIVAR,GUARANDA,#N/A,INTER PROVINCIAL,-1.44336,-7942021167,"VENTANAS,VENTANAS,LOS RIOS",GUARANDA,BOLIVAR,4/2/2022,09:04:53,105,CUARTA_CLASE,2022-02-04,9,9,5,Ma√±ana,Viernes
BOLIVAR,GUARANDA,#N/A,INTER PROVINCIAL,-1.445641667,-7943910667,"VENTANAS,VENTANAS,LOS RIOS",GUARANDA,BOLIVAR,4/2/2022,10:10:19,103,CUARTA_CLASE,2022-02-04,10,10,5,Ma√±ana,Viernes
BOLIVAR,GUARANDA,#N/A,INTER PROVINCIAL,-1.456065,-7939723833,"VENTANAS,VENTANAS,LOS RIOS",GUARANDA,BOLIVAR,4/2/2022,14:02:09,101,CUARTA_CLASE,2022-02-04,14,14,5,Tarde,Viernes
BOLIVAR,GUARANDA,#N/A,INTER PROVINCIAL,-1.4462,-7944825667,"VENTANAS,VENTANAS,LOS RIOS",GUARANDA,BOLIVAR,1/2/2022,14:38:44,103,CUARTA_CLASE,2022-02-01,14,14,2,Tarde,Martes
BOLIVAR,GUARANDA,#N/A,INTER PROVINCIAL,-1.45179,-7940458,"VENTANAS,VENTANAS,LOS RIOS",GUARANDA,BOLIVAR,2/2/2022,10:08:16,103,CUARTA_CLASE,2022-02-02,10,10,3,Ma√±ana,Mi√©rcoles
BOLIVAR,GUARANDA,#N/A,INTER PROVINCIAL,-1.44339,-7941984,"VENTANAS,VENTANAS,LOS RIOS",GUARANDA,BOLIVAR,2/2/2022,10:09:36,103,CUARTA_CLASE,2022-02-02,10,10,3,Ma√±ana,Mi√©rcoles
BOLIVAR,GUARANDA,#N/A,INTER PROVINCIAL,-1.446223333,-7944269667,"VENTANAS,VENTANAS,LOS RIOS",GUARANDA,BOLIVAR,2/2/2022,10:11:45,105,CUARTA_CLASE,2022-02-02,10,10,3,Ma√±ana,Mi√©rcoles
BOLIVAR,GUARANDA,#N/A,INTER PROVINCIAL,-1.446223333,-794429,"VENTANAS,VENTANAS,LOS RIOS",GUARANDA,BOLIVAR,2/2/2022,11:42:32,105,CUARTA_CLASE,2022-02-02,11,11,3,Ma√±ana,Mi√©rcoles
BOLIVAR,GUARANDA,#N/A,INTER PROVINCIAL,-1.83939,-7933436833,"MONTALVO,MONTALVO,LOS RIOS",GUARANDA,BOLIVAR,11/2/2022,11:02:02,103,CUARTA_CLASE,2022-02-11,11,11,5,Ma√±ana,Viernes
BOLIVAR,GUARANDA,#N/A,INTER PROVINCIAL,-1.44306,-78930355,"GUANUJO,GUARANDA,BOLIVAR",GUARANDA,BOLIVAR,1/2/2022,11:50:18,105,CUARTA_CLASE,2022-02-01,11,11,2,Ma√±ana,Martes
CA—AR,BIBLIAN,#N/A,INTER PROVINCIAL,-2.80131,-7888067167,"JAVIER LOYOLA,AZOGUES,CA—AR",BIBLIAN,CA—AR,8/2/2022,06:48:50,109,CUARTA_CLASE,2022-02-08,6,6,2,Ma√±ana,Martes
CA—AR,BIBLIAN,#N/A,INTER PROVINCIAL,-2.833446667,-78879035,"LLACAO,CUENCA,AZUAY",BIBLIAN,CA—AR,8/2/2022,06:51:54,101,CUARTA_CLASE,2022-02-08,6,6,2,Ma√±ana,Martes
CA—AR,BIBLIAN,#N/A,INTER PROVINCIAL,-2.852075,-7890524833,"NULTI,CUENCA,AZUAY",BIBLIAN,CA—AR,8/2/2022,06:55:42,101,CUARTA_CLASE,2022-02-08,6,6,2,Ma√±ana,Martes
CA—AR,BIBLIAN,#N/A,INTER PROVINCIAL,-2.825806667,-7888259833,"JAVIER LOYOLA,AZOGUES,CA—AR",BIBLIAN,CA—AR,3/2/2022,06:48:25,107,CUARTA_CLASE,2022-02-03,6,6,4,Ma√±ana,Jueves
CA—AR,BIBLIAN,#N/A,INTER PROVINCIAL,-2.80791,-7888240667,"JAVIER LOYOLA,AZOGUES,CA—AR",BIBLIAN,CA—AR,8/2/2022,06:49:19,109,CUARTA_CLASE,2022-02-08,6,6,2,Ma√±ana,Martes
CA—AR,CA—AR,#N/A,INTER PROVINCIAL,-2.780691667,-7886528167,"AZOGUES,AZOGUES,CA—AR",CA—AR,CA—AR,10/2/2022,11:09:29,101,CUARTA_CLASE,2022-02-10,11,11,4,Ma√±ana,Jueves
CA—AR,CA—AR,#N/A,INTER PROVINCIAL,-2.798346667,-7887962833,"JAVIER LOYOLA,AZOGUES,CA—AR",CA—AR,CA—AR,8/2/2022,18:08:38,103,CUARTA_CLASE,2022-02-08,18,18,2,Noche,Martes
CA—AR,CA—AR,#N/A,INTER PROVINCIAL,-2.844581667,-7888397833,"NULTI,CUENCA,AZUAY",CA—AR,CA—AR,9/2/2022,16:24:15,103,CUARTA_CLASE,2022-02-09,16,16,3,Tarde,Mi√©rcoles
CA—AR,CA—AR,#N/A,INTER PROVINCIAL,-2.847138333,-7889113,"NULTI,CUENCA,AZUAY",CA—AR,CA—AR,11/2/2022,09:26:49,101,CUARTA_CLASE,2022-02-11,9,9,5,Ma√±ana,Viernes
CA—AR,CA—AR,#N/A,INTER PROVINCIAL,-2.88806,-7895239167,"CUENCA,CUENCA,AZUAY",CA—AR,CA—AR,3/2/2022,06:14:10,107,CUARTA_CLASE,2022-02-03,6,6,4,Ma√±ana,Jueves
CA—AR,CA—AR,#N/A,INTER PROVINCIAL,-2.808451667,-7888243,"JAVIER LOYOLA,AZOGUES,CA—AR",CA—AR,CA—AR,6/2/2022,09:39:17,103,CUARTA_CLASE,2022-02-06,9,9,7,Ma√±ana,Domingo
CA—AR,CA—AR,#N/A,INTER PROVINCIAL,-2.779798333,-7886524667,"AZOGUES,AZOGUES,CA—AR",CA—AR,CA—AR,5/2/2022,10:11:30,103,CUARTA_CLASE,2022-02-05,10,10,6,Ma√±ana,S√°bado
CA—AR,CA—AR,#N/A,INTER PROVINCIAL,-2.827971667,-7888200667,"JAVIER LOYOLA,AZOGUES,CA—AR",CA—AR,CA—AR,8/2/2022,08:58:36,103,CUARTA_CLASE,2022-02-08,8,8,2,Ma√±ana,Martes
CA—AR,CA—AR,#N/A,INTER PROVINCIAL,-2.83097,-7888091667,"JAVIER LOYOLA,AZOGUES,CA—AR",CA—AR,CA—AR,7/2/2022,17:11:16,103,CUARTA_CLASE,2022-02-07,17,17,1,Tarde,Lunes
CA—AR,CA—AR,#N/A,INTER PROVINCIAL,-2.848426667,-7889540333,"NULTI,CUENCA,AZUAY",CA—AR,CA—AR,7/2/2022,10:46:50,103,CUARTA_CLASE,2022-02-07,10,10,1,Ma√±ana,Lunes
CA—AR,CA—AR,#N/A,INTER PROVINCIAL,-2.851028333,-7890251333,"NULTI,CUENCA,AZUAY",CA—AR,CA—AR,7/2/2022,10:47:21,105,CUARTA_CLASE,2022-02-07,10,10,1,Ma√±ana,Lunes
CA—AR,CA—AR,#N/A,INTER PROVINCIAL,-2.827418333,-7888222,"JAVIER LOYOLA,AZOGUES,CA—AR",CA—AR,CA—AR,9/2/2022,10:15:52,101,CUARTA_CLASE,2022-02-09,10,10,3,Ma√±ana,Mi√©rcoles
CA—AR,CA—AR,#N/A,INTER PROVINCIAL,-2.827598333,-7888220833,"JAVIER LOYOLA,AZOGUES,CA—AR",CA—AR,CA—AR,9/2/2022,08:39:17,103,CUARTA_CLASE,2022-02-09,8,8,3,Ma√±ana,Mi√©rcoles
CA—AR,CA—AR,#N/A,INTER PROVINCIAL,-2.846363333,-7888921333,"NULTI,CUENCA,AZUAY",CA—AR,CA—AR,9/2/2022,08:41:43,103,CUARTA_CLASE,2022-02-09,8,8,3,Ma√±ana,Mi√©rcoles
CA—AR,CA—AR,#N/A,INTER PROVINCIAL,-2.844185,-7888045167,"NULTI,CUENCA,AZUAY",CA—AR,CA—AR,10/2/2022,06:55:58,103,CUARTA_CLASE,2022-02-10,6,6,4,Ma√±ana,Jueves
CA—AR,CA—AR,#N/A,INTER PROVINCIAL,-2.756178333,-7885367667,"AZOGUES,AZOGUES,CA—AR",CA—AR,CA—AR,8/2/2022,14:46:06,103,CUARTA_CLASE,2022-02-08,14,14,2,Tarde,Martes
CA—AR,CA—AR,#N/A,INTER PROVINCIAL,-2.886346667,-78949345,"CUENCA,CUENCA,AZUAY",CA—AR,CA—AR,8/2/2022,14:30:22,103,CUARTA_CLASE,2022-02-08,14,14,2,Tarde,Martes
CA—AR,CA—AR,#N/A,INTER PROVINCIAL,-2.881523333,-7894567333,"CUENCA,CUENCA,AZUAY",CA—AR,CA—AR,8/2/2022,14:30:45,105,CUARTA_CLASE,2022-02-08,14,14,2,Tarde,Martes
CA—AR,CA—AR,#N/A,INTER PROVINCIAL,-2.84699,-7889078167,"NULTI,CUENCA,AZUAY",CA—AR,CA—AR,8/2/2022,14:36:14,107,CUARTA_CLASE,2022-02-08,14,14,2,Tarde,Martes
CA—AR,CA—AR,#N/A,INTER PROVINCIAL,-2.799841667,-7888009667,"JAVIER LOYOLA,AZOGUES,CA—AR",CA—AR,CA—AR,8/2/2022,14:40:55,103,CUARTA_CLASE,2022-02-08,14,14,2,Tarde,Martes
CA—AR,CA—AR,#N/A,INTER PROVINCIAL,-2.847488333,-7889229333,"NULTI,CUENCA,AZUAY",CA—AR,CA—AR,9/2/2022,18:08:00,101,CUARTA_CLASE,2022-02-09,18,18,3,Noche,Mi√©rcoles
CA—AR,CA—AR,#N/A,INTER PROVINCIAL,-2.801076667,-7888064,"JAVIER LOYOLA,AZOGUES,CA—AR",CA—AR,CA—AR,9/2/2022,16:23:29,105,CUARTA_CLASE,2022-02-09,16,16,3,Tarde,Mi√©rcoles
CA—AR,CA—AR,#N/A,INTER PROVINCIAL,-2.808136667,-7888246667,"JAVIER LOYOLA,AZOGUES,CA—AR",CA—AR,CA—AR,9/2/2022,16:24:00,101,CUARTA_CLASE,2022-02-09,16,16,3,Tarde,Mi√©rcoles
CA—AR,CA—AR,#N/A,INTER PROVINCIAL,-2.82558,-78882725,"JAVIER LOYOLA,AZOGUES,CA—AR",CA—AR,CA—AR,9/2/2022,16:26:03,105,CUARTA_CLASE,2022-02-09,16,16,3,Tarde,Mi√©rcoles
CA—AR,CA—AR,#N/A,INTER PROVINCIAL,-2.833478333,-7887903333,"LLACAO,CUENCA,AZUAY",CA—AR,CA—AR,9/2/2022,16:26:36,105,CUARTA_CLASE,2022-02-09,16,16,3,Tarde,Mi√©rcoles
CA—AR,CA—AR,#N/A,INTER PROVINCIAL,-2.840898333,-7887746167,"LLACAO,CUENCA,AZUAY",CA—AR,CA—AR,9/2/2022,16:27:09,105,CUARTA_CLASE,2022-02-09,16,16,3,Tarde,Mi√©rcoles
CA—AR,CA—AR,#N/A,INTER PROVINCIAL,-2.828965,-7888190833,"JAVIER LOYOLA,AZOGUES,CA—AR",CA—AR,CA—AR,9/2/2022,10:57:07,101,CUARTA_CLASE,2022-02-09,10,10,3,Ma√±ana,Mi√©rcoles
CA—AR,CA—AR,#N/A,INTER PROVINCIAL,-2.832583333,-7887972667,"LLACAO,CUENCA,AZUAY",CA—AR,CA—AR,9/2/2022,10:57:24,101,CUARTA_CLASE,2022-02-09,10,10,3,Ma√±ana,Mi√©rcoles
CA—AR,CA—AR,#N/A,INTER PROVINCIAL,-2.829543333,-7888156167,"JAVIER LOYOLA,AZOGUES,CA—AR",CA—AR,CA—AR,11/2/2022,17:12:52,105,CUARTA_CLASE,2022-02-11,17,17,5,Tarde,Viernes
CA—AR,CA—AR,#N/A,INTER PROVINCIAL,-2.878875,-7894351,"CUENCA,CUENCA,AZUAY",CA—AR,CA—AR,11/2/2022,09:29:04,103,CUARTA_CLASE,2022-02-11,9,9,5,Ma√±ana,Viernes
CA—AR,CA—AR,#N/A,INTER PROVINCIAL,-2.870351667,-78937175,"CUENCA,CUENCA,AZUAY",CA—AR,CA—AR,11/2/2022,09:29:46,103,CUARTA_CLASE,2022-02-11,9,9,5,Ma√±ana,Viernes
CA—AR,CA—AR,#N/A,INTER PROVINCIAL,-2.848043333,-7889384,"NULTI,CUENCA,AZUAY",CA—AR,CA—AR,11/2/2022,09:33:30,101,CUARTA_CLASE,2022-02-11,9,9,5,Ma√±ana,Viernes
CA—AR,CA—AR,#N/A,INTER PROVINCIAL,-2.827598333,-7888206,"JAVIER LOYOLA,AZOGUES,CA—AR",CA—AR,CA—AR,11/2/2022,09:35:55,107,CUARTA_CLASE,2022-02-11,9,9,5,Ma√±ana,Viernes
CA—AR,CA—AR,#N/A,INTER PROVINCIAL,-2.781173333,-7886527,"AZOGUES,AZOGUES,CA—AR",CA—AR,CA—AR,11/2/2022,07:52:19,101,CUARTA_CLASE,2022-02-11,7,7,5,Ma√±ana,Viernes
CA—AR,CA—AR,#N/A,INTER PROVINCIAL,-2.826158333,-7888255,"JAVIER LOYOLA,AZOGUES,CA—AR",CA—AR,CA—AR,11/2/2022,07:57:29,103,CUARTA_CLASE,2022-02-11,7,7,5,Ma√±ana,Viernes
CA—AR,CA—AR,#N/A,INTER PROVINCIAL,-2.850365,-7890086667,"NULTI,CUENCA,AZUAY",CA—AR,CA—AR,11/2/2022,08:00:58,103,CUARTA_CLASE,2022-02-11,8,8,5,Ma√±ana,Viernes
CA—AR,CA—AR,#N/A,INTER PROVINCIAL,-2.799295,-7887991167,"JAVIER LOYOLA,AZOGUES,CA—AR",CA—AR,CA—AR,2/2/2022,10:14:57,101,CUARTA_CLASE,2022-02-02,10,10,3,Ma√±ana,Mi√©rcoles
CA—AR,CA—AR,#N/A,INTER PROVINCIAL,-2.84689,-7889033833,"NULTI,CUENCA,AZUAY",CA—AR,CA—AR,2/2/2022,16:36:30,101,CUARTA_CLASE,2022-02-02,16,16,3,Tarde,Mi√©rcoles
CA—AR,CA—AR,#N/A,INTER PROVINCIAL,-2.84436,-7888200167,"NULTI,CUENCA,AZUAY",CA—AR,CA—AR,2/2/2022,16:37:07,103,CUARTA_CLASE,2022-02-02,16,16,3,Tarde,Mi√©rcoles
CA—AR,CA—AR,#N/A,INTER PROVINCIAL,-2.840265,-7887718667,"LLACAO,CUENCA,AZUAY",CA—AR,CA—AR,2/2/2022,16:37:36,103,CUARTA_CLASE,2022-02-02,16,16,3,Tarde,Mi√©rcoles
CA—AR,CA—AR,#N/A,INTER PROVINCIAL,-2.827368333,-7888211,"JAVIER LOYOLA,AZOGUES,CA—AR",CA—AR,CA—AR,2/2/2022,16:38:37,105,CUARTA_CLASE,2022-02-02,16,16,3,Tarde,Mi√©rcoles
CA—AR,CA—AR,#N/A,INTER PROVINCIAL,-2.756775,-7885417333,"AZOGUES,AZOGUES,CA—AR",CA—AR,CA—AR,2/2/2022,16:45:51,103,CUARTA_CLASE,2022-02-02,16,16,3,Tarde,Mi√©rcoles
CA—AR,CA—AR,#N/A,INTER PROVINCIAL,-2.867858333,-7893568833,"CUENCA,CUENCA,AZUAY",CA—AR,CA—AR,4/2/2022,14:08:47,101,CUARTA_CLASE,2022-02-04,14,14,5,Tarde,Viernes
CA—AR,CA—AR,#N/A,INTER PROVINCIAL,-2.84784,-7889325,"NULTI,CUENCA,AZUAY",CA—AR,CA—AR,6/2/2022,07:13:13,105,CUARTA_CLASE,2022-02-06,7,7,7,Ma√±ana,Domingo
CA—AR,CA—AR,#N/A,INTER PROVINCIAL,-2.880941667,-78945225,"CUENCA,CUENCA,AZUAY",CA—AR,CA—AR,5/2/2022,12:01:57,103,CUARTA_CLASE,2022-02-05,12,12,6,Tarde,S√°bado
CA—AR,CA—AR,#N/A,INTER PROVINCIAL,-2.8711,-7893764667,"CUENCA,CUENCA,AZUAY",CA—AR,CA—AR,5/2/2022,12:02:47,101,CUARTA_CLASE,2022-02-05,12,12,6,Tarde,S√°bado
CA—AR,CA—AR,#N/A,INTER PROVINCIAL,-2.846808333,-788902,"NULTI,CUENCA,AZUAY",CA—AR,CA—AR,5/2/2022,12:07:19,103,CUARTA_CLASE,2022-02-05,12,12,6,Tarde,S√°bado
CA—AR,CA—AR,#N/A,INTER PROVINCIAL,-2.827963333,-7888199333,"JAVIER LOYOLA,AZOGUES,CA—AR",CA—AR,CA—AR,5/2/2022,12:09:24,103,CUARTA_CLASE,2022-02-05,12,12,6,Tarde,S√°bado
CA—AR,CA—AR,#N/A,INTER PROVINCIAL,-2.879428333,-7894405,"CUENCA,CUENCA,AZUAY",CA—AR,CA—AR,8/2/2022,08:34:53,103,CUARTA_CLASE,2022-02-08,8,8,2,Ma√±ana,Martes
CA—AR,CA—AR,#N/A,INTER PROVINCIAL,-2.86983,-78936895,"CUENCA,CUENCA,AZUAY",CA—AR,CA—AR,8/2/2022,08:35:43,105,CUARTA_CLASE,2022-02-08,8,8,2,Ma√±ana,Martes
CA—AR,CA—AR,#N/A,INTER PROVINCIAL,-2.828148333,-7888192833,"JAVIER LOYOLA,AZOGUES,CA—AR",CA—AR,CA—AR,8/2/2022,08:42:12,103,CUARTA_CLASE,2022-02-08,8,8,2,Ma√±ana,Martes
CA—AR,EL TAMBO,#N/A,INTRA PROVINCIAL,-2.485891667,-78983935,"JUNCAL,CA—AR",EL TAMBO,CA—AR,7/2/2022,20:35:36,123,PRIMERA_CLASE,2022-02-07,20,20,1,Noche,Lunes
CA—AR,LA TRONCAL,#N/A,INTER PROVINCIAL,-2.241723333,-7967857833,"VIRGEN DE FATIMA,SAN JACINTO DE YAGUACHI,GUAYAS",LA TRONCAL,CA—AR,6/2/2022,18:10:51,101,CUARTA_CLASE,2022-02-06,18,18,7,Noche,Domingo
CA—AR,LA TRONCAL,#N/A,INTER PROVINCIAL,-2.567575,-79571025,"JESUS MARIA,NARANJAL,GUAYAS",LA TRONCAL,CA—AR,11/2/2022,14:09:57,103,CUARTA_CLASE,2022-02-11,14,14,5,Tarde,Viernes
CA—AR,LA TRONCAL,#N/A,INTER PROVINCIAL,-2.256293333,-7959409167,"GRAL. PEDRO J. MONTERO,SAN JACINTO DE YAGUACHI,GUAYAS",LA TRONCAL,CA—AR,9/2/2022,05:56:11,103,CUARTA_CLASE,2022-02-09,5,5,3,Madrugada,Mi√©rcoles
CA—AR,LA TRONCAL,#N/A,INTER PROVINCIAL,-2.308755,-7947904667,"EL TRIUNFO,EL TRIUNFO,GUAYAS",LA TRONCAL,CA—AR,10/2/2022,08:56:09,101,CUARTA_CLASE,2022-02-10,8,8,4,Ma√±ana,Jueves
CARCHI,ESPEJO,#N/A,INTER PROVINCIAL,0.572048333,-7795240833,"GARCIA MORENO,BOLIVAR,CARCHI",ESPEJO,CARCHI,2/2/2022,14:30:40,107,CUARTA_CLASE,2022-02-02,14,14,3,Tarde,Mi√©rcoles
CARCHI,ESPEJO,#N/A,INTER PROVINCIAL,0.203361667,-7824344333,"EUGENIO ESPEJO,OTAVALO,IMBABURA",ESPEJO,CARCHI,7/2/2022,09:38:48,111,CUARTA_CLASE,2022-02-07,9,9,1,Ma√±ana,Lunes
CARCHI,ESPEJO,#N/A,INTER PROVINCIAL,0.33656,-78192635,"SAN FCO. DE NATABUELA,ANTONIO ANTE,IMBABURA",ESPEJO,CARCHI,10/2/2022,10:18:29,111,CUARTA_CLASE,2022-02-10,10,10,4,Ma√±ana,Jueves
CARCHI,ESPEJO,#N/A,INTER PROVINCIAL,0.205335,-7824584667,"EUGENIO ESPEJO,OTAVALO,IMBABURA",ESPEJO,CARCHI,10/2/2022,12:29:20,103,CUARTA_CLASE,2022-02-10,12,12,4,Tarde,Jueves
CARCHI,ESPEJO,#N/A,INTER PROVINCIAL,0.195876667,-7823410333,"SAN RAFAEL,OTAVALO,IMBABURA",ESPEJO,CARCHI,3/2/2022,17:04:53,111,CUARTA_CLASE,2022-02-03,17,17,4,Tarde,Jueves
CARCHI,ESPEJO,#N/A,INTER PROVINCIAL,0.42455,-7812229667,"IBARRA,IBARRA,IMBABURA",ESPEJO,CARCHI,8/2/2022,13:59:35,105,CUARTA_CLASE,2022-02-08,13,13,2,Tarde,Martes
CARCHI,ESPEJO,#N/A,INTER PROVINCIAL,0.31419,-7822450833,"ATUNTAQUI,ANTONIO ANTE,IMBABURA",ESPEJO,CARCHI,11/2/2022,13:16:54,103,CUARTA_CLASE,2022-02-11,13,13,5,Tarde,Viernes
CARCHI,MONTUFAR,#N/A,INTRA PROVINCIAL,-0.566473333,-7746487167,"AVILA,LORETO,ORELLANA",MONTUFAR,CARCHI,3/2/2022,22:23:15,123,PRIMERA_CLASE,2022-02-03,22,22,4,Noche,Jueves
CARCHI,MONTUFAR,#N/A,INTRA PROVINCIAL,2.057761667,-8002245167,NA,MONTUFAR,CARCHI,9/2/2022,15:23:42,105,CUARTA_CLASE,2022-02-09,15,15,3,Tarde,Mi√©rcoles
CARCHI,MONTUFAR,#N/A,INTRA PROVINCIAL,0.50927,-7789857667,"BOLIVAR,BOLIVAR,CARCHI",MONTUFAR,CARCHI,7/2/2022,06:54:16,118,PRIMERA_CLASE,2022-02-07,6,6,1,Ma√±ana,Lunes
CARCHI,MONTUFAR,#N/A,INTRA PROVINCIAL,0.565991667,-7783425,"SAN GABRIEL,MONTUFAR,CARCHI",MONTUFAR,CARCHI,1/2/2022,08:25:19,105,CUARTA_CLASE,2022-02-01,8,8,2,Ma√±ana,Martes
CARCHI,MONTUFAR,#N/A,INTRA PROVINCIAL,0.513615,-7787360833,"LA PAZ,MONTUFAR,CARCHI",MONTUFAR,CARCHI,7/2/2022,07:31:51,112,CUARTA_CLASE,2022-02-07,7,7,1,Ma√±ana,Lunes
CARCHI,MONTUFAR,#N/A,INTRA PROVINCIAL,0.560191667,-7783738,"LA PAZ,MONTUFAR,CARCHI",MONTUFAR,CARCHI,5/2/2022,10:05:26,101,CUARTA_CLASE,2022-02-05,10,10,6,Ma√±ana,S√°bado
CARCHI,MONTUFAR,#N/A,INTRA PROVINCIAL,0.533403333,-7785511,"LA PAZ,MONTUFAR,CARCHI",MONTUFAR,CARCHI,7/2/2022,12:48:42,112,CUARTA_CLASE,2022-02-07,12,12,1,Tarde,Lunes
CARCHI,MONTUFAR,#N/A,INTRA PROVINCIAL,0.547885,-77847525,"LA PAZ,MONTUFAR,CARCHI",MONTUFAR,CARCHI,7/2/2022,12:47:14,107,CUARTA_CLASE,2022-02-07,12,12,1,Tarde,Lunes
CARCHI,MONTUFAR,#N/A,INTRA PROVINCIAL,0.567046667,-7782584,"SAN GABRIEL,MONTUFAR,CARCHI",MONTUFAR,CARCHI,7/2/2022,13:32:03,131,PRIMERA_CLASE,2022-02-07,13,13,1,Tarde,Lunes
CARCHI,MONTUFAR,#N/A,INTRA PROVINCIAL,0.511893333,-7788865833,"BOLIVAR,BOLIVAR,CARCHI",MONTUFAR,CARCHI,7/2/2022,13:12:57,109,CUARTA_CLASE,2022-02-07,13,13,1,Tarde,Lunes
CARCHI,MONTUFAR,#N/A,INTER PROVINCIAL,0.193466667,-7822973333,"SAN RAFAEL,OTAVALO,IMBABURA",MONTUFAR,CARCHI,11/2/2022,10:18:48,105,CUARTA_CLASE,2022-02-11,10,10,5,Ma√±ana,Viernes
CARCHI,MONTUFAR,#N/A,INTER PROVINCIAL,0.588226667,-7783913833,"SAN GABRIEL,MONTUFAR,CARCHI",MONTUFAR,CARCHI,10/2/2022,23:00:40,120,PRIMERA_CLASE,2022-02-10,23,23,4,Noche,Jueves
CARCHI,MONTUFAR,#N/A,INTER PROVINCIAL,0.436428333,-7797049833,"AMBUQUI,IBARRA,IMBABURA",MONTUFAR,CARCHI,11/2/2022,12:11:26,103,CUARTA_CLASE,2022-02-11,12,12,5,Tarde,Viernes
CARCHI,MONTUFAR,#N/A,INTER PROVINCIAL,0.437631667,-7797759667,"AMBUQUI,IBARRA,IMBABURA",MONTUFAR,CARCHI,11/2/2022,12:10:57,101,CUARTA_CLASE,2022-02-11,12,12,5,Tarde,Viernes
CARCHI,MONTUFAR,#N/A,INTER PROVINCIAL,0.435811667,-77984635,"AMBUQUI,IBARRA,IMBABURA",MONTUFAR,CARCHI,11/2/2022,12:10:29,111,CUARTA_CLASE,2022-02-11,12,12,5,Tarde,Viernes
CARCHI,MONTUFAR,#N/A,INTER PROVINCIAL,0.5119,-77888705,"BOLIVAR,BOLIVAR,CARCHI",MONTUFAR,CARCHI,11/2/2022,12:41:49,103,CUARTA_CLASE,2022-02-11,12,12,5,Tarde,Viernes
CARCHI,MONTUFAR,#N/A,INTER PROVINCIAL,0.513451667,-7787170833,"LA PAZ,MONTUFAR,CARCHI",MONTUFAR,CARCHI,11/2/2022,12:43:46,103,CUARTA_CLASE,2022-02-11,12,12,5,Tarde,Viernes
CARCHI,MONTUFAR,#N/A,INTER PROVINCIAL,0.522356667,-7786193,"LA PAZ,MONTUFAR,CARCHI",MONTUFAR,CARCHI,11/2/2022,12:44:56,107,CUARTA_CLASE,2022-02-11,12,12,5,Tarde,Viernes
CARCHI,MONTUFAR,#N/A,INTER PROVINCIAL,0.474295,-7807224167,"AMBUQUI,IBARRA,IMBABURA",MONTUFAR,CARCHI,11/2/2022,11:50:20,103,CUARTA_CLASE,2022-02-11,11,11,5,Ma√±ana,Viernes
CARCHI,MONTUFAR,#N/A,INTER PROVINCIAL,0.468665,-7802505167,"AMBUQUI,IBARRA,IMBABURA",MONTUFAR,CARCHI,11/2/2022,12:05:24,101,CUARTA_CLASE,2022-02-11,12,12,5,Tarde,Viernes
CARCHI,MONTUFAR,#N/A,INTER PROVINCIAL,0.317181667,-7822273333,"ATUNTAQUI,ANTONIO ANTE,IMBABURA",MONTUFAR,CARCHI,11/2/2022,05:35:08,101,CUARTA_CLASE,2022-02-11,5,5,5,Madrugada,Viernes
CARCHI,MONTUFAR,#N/A,INTER PROVINCIAL,0.468603333,-7801616167,"AMBUQUI,IBARRA,IMBABURA",MONTUFAR,CARCHI,11/2/2022,12:05:59,103,CUARTA_CLASE,2022-02-11,12,12,5,Tarde,Viernes
CARCHI,MONTUFAR,#N/A,INTER PROVINCIAL,0.444,-7811769167,"IBARRA,IBARRA,IMBABURA",MONTUFAR,CARCHI,11/2/2022,11:36:35,105,CUARTA_CLASE,2022-02-11,11,11,5,Ma√±ana,Viernes
CARCHI,MONTUFAR,#N/A,INTER PROVINCIAL,0.279923333,-7823754167,"SAN JUAN DE ILUMAN,OTAVALO,IMBABURA",MONTUFAR,CARCHI,11/2/2022,10:35:36,103,CUARTA_CLASE,2022-02-11,10,10,5,Ma√±ana,Viernes
CARCHI,MONTUFAR,#N/A,INTER PROVINCIAL,0.439991667,-7799811833,"AMBUQUI,IBARRA,IMBABURA",MONTUFAR,CARCHI,11/2/2022,12:09:08,103,CUARTA_CLASE,2022-02-11,12,12,5,Tarde,Viernes
